SYMBOL;DESCRIPTION;IBKR SYMBOL;CURRENCY;PRODUCT;REGION;EXCHANGE *PRIMARY EXCHANGE;Classificação Econômica;inloco
09K0;ARK SPACE EXPLORATION & INNO;09K0;EUR;ETF;US;GETTEX*;Desenvolvido;0
09KA;THE 3D PRINTING ETF;09KA;EUR;ETF;US;GETTEX*;Desenvolvido;0
0BYB;ISHARES GLOBAL CLEAN ENERGY;0BYB;EUR;ETF;US;GETTEX*;Desenvolvido;0
2840;SPDR GOLD SHARES;2840;HKD;ETF;US;SEHK*;Desenvolvido;0
82840;SPDR GOLD SHARES - RMB;82840;CNH;ETF;US;SEHK*;Desenvolvido;0
9840;SPDR GOLD SHARES - USD;9840;USD;ETF;US;SEHK*;Desenvolvido;1
AAA;ALTERNATIVE ACCESS FIRST PRI;AAA;USD;ETF;US;NYSE;Desenvolvido;1
AAAU;GOLDMAN SACHS PHYSICAL GOLD;AAAU;USD;ETF;US;AMEX;Desenvolvido;1
AAAU;GOLDMAN SACHS PHYSICAL GOLD;AAAU;MXN;ETF;US;MEXI*;Desenvolvido;0
AADR;ADVISORSHARES DORSEY WRIGHT;AADR;USD;ETF;US;NYSENAT;Desenvolvido;1
AAPB;GRANITESHARES 2X LONG AAPL D;AAPB;USD;ETF;US;IEX;Desenvolvido;1
AAPD;DIREXION DAILY AAPL BEAR 1X;AAPD;USD;ETF;US;BATS;Desenvolvido;1
AAPR;IN ED PR ETF - 2YR TO A 2026;AAPR;USD;ETF;US;NYSE;Desenvolvido;1
AAPU;DIREXION DAILY AAPL BULL 2X;AAPU;USD;ETF;US;DRCTEDGE;Desenvolvido;1
AAPX;T-REX 2X LNG APPLE DLY TRGT;AAPX;USD;ETF;US;ARCA;Desenvolvido;1
AAPY;KURV YLD PREM STR AAPL ETF;AAPY;USD;ETF;US;PSX;Desenvolvido;1
AAXJ;ISHARES MSCI ALL COUNTRY ASI;AAXJ;USD;ETF;US;OVERNIGHT;Desenvolvido;1
AAXJ;ISHARES MSCI ALL COUNTRY ASI;AAXJ;MXN;ETF;US;MEXI*;Desenvolvido;0
ABCS;ALPHA BLUE CAP US S-M DYN;ABCS;USD;ETF;US;NASDAQ*;Desenvolvido;1
ABEQ;ABSOLUTE SELECT VALUE ETF;ABEQ;USD;ETF;US;NYSENAT;Desenvolvido;1
ABFL;ABACUS FCF LEADERS ETF;ABFL;USD;ETF;US;PSX;Desenvolvido;1
ABHY;ABACUS TACTICAL HIGH YIELD E;ABHY;USD;ETF;US;LTSE;Desenvolvido;1
ABLD;ABA FCF RAL ASET LAD ETF-USD;ABLD;USD;ETF;US;LTSE;Desenvolvido;1
ABLG;ABAC FCF INTERN LEAD ETF-USD;ABLG;USD;ETF;US;MEMX;Desenvolvido;1
ABNY;YLDMX ABNB OP INC STRTG ETF;ABNY;USD;ETF;US;PHLX;Desenvolvido;1
ABOT;ABACUS FCF INNOVATION LEADER;ABOT;USD;ETF;US;AMEX;Desenvolvido;1
ACES;ALPS CLEAN ENERGY ETF;ACES;USD;ETF;US;ARCA*;Desenvolvido;1
ACGR;AMERICAN CENTURY LARGE CAP G;ACGR;USD;ETF;US;EDGEA;Desenvolvido;1
ACIO;APTUS COLLARED INVESTMENT OP;ACIO;USD;ETF;US;CHX;Desenvolvido;1
ACLC;AMERICAN CENTURY LARGE CAP E;ACLC;USD;ETF;US;DRCTEDGE;Desenvolvido;1
ACLO;TCW AAA CLO ETF;ACLO;USD;ETF;US;OVERNIGHT;Desenvolvido;1
ACSI;AMERICAN CUSTOMER SATISFACTI;ACSI;USD;ETF;US;MEMX;Desenvolvido;1
ACTV;LEADERSHARES ACTIVIST LEADER;ACTV;USD;ETF;US;AMEX;Desenvolvido;1
ACVF;AMERICAN CONSERVATIVE VALUES;ACVF;USD;ETF;US;MEMX;Desenvolvido;1
ACWI;ISHARES MSCI ACWI ETF;ACWI;USD;ETF;US;CBOE;Desenvolvido;1
ACWV;ISHARES MSCI GLOBAL MIN VOL;ACWV;USD;ETF;US;BATS*;Desenvolvido;1
ACWV;ISHARES MSCI GLOBAL MIN VOL;ACWV;MXN;ETF;US;MEXI*;Desenvolvido;0
ACWX;ISHARES MSCI ACWI EX US ETF;ACWX;USD;ETF;US;DRCTEDGE;Desenvolvido;1
ADFI;ANFIELD DYNAMIC FIXED INCOME;ADFI;USD;ETF;US;NYSENAT;Desenvolvido;1
ADIV;SMARTETFS APAC DVD BUILDER;ADIV;USD;ETF;US;BATS;Desenvolvido;1
ADME;APTUS DRAWDOWN MANAGED EQUIT;ADME;USD;ETF;US;IBEOS;Desenvolvido;1
ADPV;ADAPTIV SELECT ETF;ADPV;USD;ETF;US;AMEX;Desenvolvido;1
ADVE;MATTHEWS ASIA DIVIDEND ETF;ADVE;USD;ETF;US;IEX;Desenvolvido;1
ADZCF;DB AGRICULTURE SHORT ETN;ADZCF;USD;ETF;US;OTCLNKECN;Desenvolvido;1
AESR;ANFIELD US EQUITY SECTOR ROT;AESR;USD;ETF;US;BEX;Desenvolvido;1
AETH;BIT TRE ETH TRE RO ST ET-USD;AETH;USD;ETF;US;BEX;Desenvolvido;1
AFIF;ANFIELD UNIVERSAL FIXED INCO;AFIF;USD;ETF;US;IBEOS;Desenvolvido;1
AFIX;ALLSPRING BRD MRKT CORE BND;AFIX;USD;ETF;US;MEMX;Desenvolvido;1
AFK;VANECK AFRICA INDEX ETF;AFK;USD;ETF;US;AMEX;Desenvolvido;1
AFLG;FIRST TRUST ACTIVE FACTOR LA;AFLG;USD;ETF;US;CHX;Desenvolvido;1
AFMC;FIRST TRUST ACTIVE FACTOR MI;AFMC;USD;ETF;US;BEX;Desenvolvido;1
AFSM;FIRST TRUST ACTIVE FACTOR SM;AFSM;USD;ETF;US;AMEX;Desenvolvido;1
AGFXF;DB AGRICULTURE LONG ETN;AGFXF;USD;ETF;US;OTCLNKECN;Desenvolvido;1
AGG;ISHARES CORE U.S. AGGREGATE;AGG;USD;ETF;US;BATS;Desenvolvido;1
AGG;ISHARES CORE U.S. AGGREGATE;AGG;MXN;ETF;US;MEXI*;Desenvolvido;0
AGGH;SIMPLIFY AGGREGATE BOND ETF;AGGH;USD;ETF;US;NYSENAT;Desenvolvido;1
AGGS;HARBOR DISCIPLINED BOND ETF;AGGS;USD;ETF;US;LTSE;Desenvolvido;1
AGGY;WISDOMTREE YIELD ENHANCED US;AGGY;USD;ETF;US;LTSE;Desenvolvido;1
AGGY;WISDOMTREE YIELD ENHANCED US;AGGY;MXN;ETF;US;MEXI*;Desenvolvido;0
AGIH;ISHARES INFLATION HEDGED US;AGIH;USD;ETF;US;MEMX;Desenvolvido;1
AGIX;KRANESHARES AI & TECH ETF;AGIX;USD;ETF;US;DRCTEDGE;Desenvolvido;1
AGMI;THEMES SILVER MINERS ETF;AGMI;USD;ETF;US;PSX;Desenvolvido;1
AGNG;GLB X AGING POPULATION ETF;AGNG;USD;ETF;US;PSX;Desenvolvido;1
AGNG;GLB X AGING POPULATION ETF;AGNG;MXN;ETF;US;MEXI*;Desenvolvido;0
AGOX;ADAPTIVE ALPHA OPPORTUNITIES;AGOX;USD;ETF;US;PHLX;Desenvolvido;1
AGQ;PROSHARES ULTRA SILVER;AGQ;USD;ETF;US;EDGEA;Desenvolvido;1
AGQI;FIRST TR ACT GLBL QLTY INC;AGQI;USD;ETF;US;LTSE;Desenvolvido;1
AGRH;ISHARES INTEREST RATE HEDGED;AGRH;USD;ETF;US;AMEX;Desenvolvido;1
AGZ;ISHARES AGENCY BOND ETF;AGZ;USD;ETF;US;PHLX;Desenvolvido;1
AGZD;WISDOMTREE TRUST WISDOMTREE;AGZD;USD;ETF;US;EDGEA;Desenvolvido;1
AGZD;WISDOMTREE TRUST WISDOMTREE;AGZD;MXN;ETF;US;MEXI*;Desenvolvido;0
AHLT;AMERICAN BEACON AHL TREND;AHLT;USD;ETF;US;EDGEA;Desenvolvido;1
AHYB;AMERICAN CENTURY SELECT HY;AHYB;USD;ETF;US;DRCTEDGE;Desenvolvido;1
AIA;ISHARES ASIA 50 ETF;AIA;USD;ETF;US;BEX;Desenvolvido;1
AIA;ISHARES ASIA 50 ETF;AIA;MXN;ETF;US;MEXI*;Desenvolvido;0
AIBD;DX DAILYAI &BIG DATA BEAR 2X;AIBD;USD;ETF;US;MEMX;Desenvolvido;1
AIBU;DXDAILYAI AND BIG DATABULL2X;AIBU;USD;ETF;US;OVERNIGHT;Desenvolvido;1
AIEQ;AMPLIFY AI POWERED EQUITY;AIEQ;USD;ETF;US;CHX;Desenvolvido;1
AIFD;TCW ARTIFICIAL INTEL ETF;AIFD;USD;ETF;US;NYSE*;Desenvolvido;1
AINP;ALLSPRING INCOME PLUS ETF;AINP;USD;ETF;US;MEMX;Desenvolvido;1
AIPI;REX AI EQUITY PREM INC ETF;AIPI;USD;ETF;US;MEMX;Desenvolvido;1
AIQ;GLOBAL X ART INTEL & TECH;AIQ;USD;ETF;US;AMEX;Desenvolvido;1
AIQ;GLOBAL X ART INTEL & TECH;AIQ;MXN;ETF;US;MEXI*;Desenvolvido;0
AIRL;THEMES AIRLINES ETF;AIRL;USD;ETF;US;PHLX;Desenvolvido;1
AIRR;FIRST TRUST RBA AMERICAN IND;AIRR;USD;ETF;US;AMEX;Desenvolvido;1
AIRR;FIRST TRUST RBA AMERICAN IND;AIRR;MXN;ETF;US;MEXI*;Desenvolvido;0
AIS;VISTASHARES AIS ETF;AIS;USD;ETF;US;AMEX;Desenvolvido;1
AIVC;AMPLIFY BLOOMBERG AI VALUE C;AIVC;USD;ETF;US;CHX;Desenvolvido;1
AIVI;WISDOMTREE INTERNATIONAL AI;AIVI;USD;ETF;US;NYSE;Desenvolvido;1
AIVL;WISDOMTREE US AI ENHANCED VA;AIVL;USD;ETF;US;EDGEA;Desenvolvido;1
AIYY;YIELDMAX AI OP INC STR ETF;AIYY;USD;ETF;US;BEX;Desenvolvido;1
AJAN;INNOVATOR EQ DEF PROT 2YJ26;AJAN;USD;ETF;US;DRCTEDGE;Desenvolvido;1
AJUL;INVTOR EDP ETF 2YR TO JY2026;AJUL;USD;ETF;US;IBEOS;Desenvolvido;1
ALAI;ALGER AI ENABLE & ADOPT ETF;ALAI;USD;ETF;US;BEX;Desenvolvido;1
ALTL;PACER LUNT LARGE CAP ALTERNA;ALTL;USD;ETF;US;AMEX;Desenvolvido;1
ALTY;GLOBAL X ALTERNATIVE INCOME;ALTY;USD;ETF;US;CHX;Desenvolvido;1
ALTY;GLOBAL X ALTERNATIVE INCOME;ALTY;MXN;ETF;US;MEXI*;Desenvolvido;0
AMAX;ADAPTIVE HEDGED MULTI-ASSET;AMAX;USD;ETF;US;EDGEA;Desenvolvido;1
AMDL;GRANITESHARES 2XLONG AMD ETF;AMDL;USD;ETF;US;BEX;Desenvolvido;1
AMDS;GRANITE 1X SHORT AMD ETF;AMDS;USD;ETF;US;BEX;Desenvolvido;1
AMDY;YIELDMAX AMD OPTION IS ETF;AMDY;USD;ETF;US;IBEOS;Desenvolvido;1
AMID;ARGENT MID CAP ETF;AMID;USD;ETF;US;NYSE;Desenvolvido;1
AMJB;ALERIAN MLP ETN2044;AMJB;USD;ETF;US;DRCTEDGE;Desenvolvido;1
AMLP;ALERIAN MLP ETF;AMLP;MXN;ETF;US;MEXI*;Desenvolvido;0
AMLP;ALERIAN MLP ETF;AMLP;USD;ETF;US;IEX;Desenvolvido;1
AMOM;QRAFT AI-ENH US LRG CAP MTM;AMOM;USD;ETF;US;ARCA*;Desenvolvido;1
AMPD;CNIC ICE US CBN NTL PWR FI;AMPD;USD;ETF;US;EDGEA;Desenvolvido;1
AMUB;ETRACS ALERIAN MLP IND SER B;AMUB;USD;ETF;US;BYX;Desenvolvido;1
AMZA;INFRACAP MLP ETF;AMZA;USD;ETF;US;BEX;Desenvolvido;1
AMZD;DRX DLY AMZN BEAR 1X;AMZD;USD;ETF;US;LTSE;Desenvolvido;1
AMZP;KURV YLD PREM STR AMZN ETF;AMZP;USD;ETF;US;NYSE;Desenvolvido;1
AMZU;DIREXION DAILY AMZN BULL 2X;AMZU;USD;ETF;US;AMEX;Desenvolvido;1
AMZY;YIELDMAX AMAZN OPTION INCOME;AMZY;USD;ETF;US;BEX;Desenvolvido;1
AMZZ;GRANITESHARES 2XL AMZN ETF;AMZZ;USD;ETF;US;NYSENAT;Desenvolvido;1
ANEW;PROSHARES MSCI TRANSFORM CHG;ANEW;USD;ETF;US;DRCTEDGE;Desenvolvido;1
ANGL;VANECK FALLEN ANGEL HIGH YLD;ANGL;USD;ETF;US;LTSE;Desenvolvido;1
ANGL;VANECK FALLEN ANGEL HIGH YLD;ANGL;MXN;ETF;US;MEXI*;Desenvolvido;0
AOA;ISHARES CORE AGGRESSIVE ALLO;AOA;USD;ETF;US;DRCTEDGE;Desenvolvido;1
AOCT;IN EQU D PR ETF - 2 Y O 2026;AOCT;USD;ETF;US;PSX;Desenvolvido;1
AOHY;ANGEL OAK HIGH YILD OPPO ETF;AOHY;USD;ETF;US;BEX;Desenvolvido;1
AOK;ISHARES CORE CONSERVATIVE AL;AOK;USD;ETF;US;DRCTEDGE;Desenvolvido;1
AOM;ISHARES CORE MODERATE ALLOCA;AOM;USD;ETF;US;IEX;Desenvolvido;1
AOR;ISHARES CORE GROWTH ALLOCATI;AOR;USD;ETF;US;DRCTEDGE;Desenvolvido;1
AOTG;AOT GROWTH AND INNOVATION;AOTG;USD;ETF;US;IEX;Desenvolvido;1
APCB;ACTIVEPASSIVE CORE BOND ETF;APCB;USD;ETF;US;IBEOS;Desenvolvido;1
APIE;ACTIVEPASSIVE INTL EQTY ETF;APIE;USD;ETF;US;IEX;Desenvolvido;1
APLU;ALLSPRING CORE PLUS ETF;APLU;USD;ETF;US;CHX;Desenvolvido;1
APLY;YIELDMAX AAPL OPTION INCOME;APLY;USD;ETF;US;BYX;Desenvolvido;1
APMU;ACTIVEPASSIVE INTERM MUNI BD;APMU;USD;ETF;US;EDGEA;Desenvolvido;1
APOC;INR EQTY DEF P ETF - 6 M A/O;APOC;USD;ETF;US;IEX;Desenvolvido;1
APRD;INNOV PREM INC 10 BARR-APRIL;APRD;USD;ETF;US;IEX;Desenvolvido;1
APRH;INNOV PREM INC 20 BARR-APRIL;APRH;USD;ETF;US;BEX;Desenvolvido;1
APRJ;INNOV PREM INC 30 BARR-APRIL;APRJ;USD;ETF;US;IBEOS;Desenvolvido;1
APRP;PGIM US L-C BUF 12 ETF - APR;APRP;USD;ETF;US;AMEX;Desenvolvido;1
APRQ;INNOVATOR PREM INC 40 BAR-AP;APRQ;USD;ETF;US;LTSE;Desenvolvido;1
APRT;ALLIANZIM US LG CAP BUFFER10;APRT;USD;ETF;US;BEX;Desenvolvido;1
APRW;ALLIANZIM US LC BUFFER20 APR;APRW;USD;ETF;US;NYSENAT;Desenvolvido;1
APRZ;TRUESHARES STR OUTCOME APRIL;APRZ;USD;ETF;US;OVERNIGHT;Desenvolvido;1
APUE;ACTIVEPASSIVE US EQUITY ETF;APUE;USD;ETF;US;CHX;Desenvolvido;1
AQLT;ISHARES MSCI GL QUA FACT ETF;AQLT;USD;ETF;US;BEX;Desenvolvido;1
AQWA;GLOBAL X CLEAN WATER ETF;AQWA;USD;ETF;US;ARCA;Desenvolvido;1
AQWA;GLOBAL X CLEAN WATER ETF;AQWA;MXN;ETF;US;MEXI*;Desenvolvido;0
ARB;ALTSHARES MERGER ARBITRAGE;ARB;USD;ETF;US;EDGEA;Desenvolvido;1
ARCM;ARROW RESERVE CAP MGMT ETF;ARCM;USD;ETF;US;IEX;Desenvolvido;1
AREA;HARBOR APED NX GEN REIT ETF;AREA;USD;ETF;US;ARCA*;Desenvolvido;1
ARGT;GLOBAL X MSCI ARGENTINA ETF;ARGT;USD;ETF;US;CHX;Desenvolvido;1
ARGT;GLOBAL X MSCI ARGENTINA ETF;ARGT;MXN;ETF;US;MEXI*;Desenvolvido;0
ARKA;ARK 21SHRS ACTBITC FUT STRGY;ARKA;USD;ETF;US;IEX;Desenvolvido;1
ARKB;ARK 21SHARES BITCOIN ETF;ARKB;USD;ETF;US;BEX;Desenvolvido;1
ARKC;ARK 21SHRS ACT OC BIT STRGY;ARKC;USD;ETF;US;BEX;Desenvolvido;1
ARKD;ARK 21SHRS BLCKCHN DIG EC IN;ARKD;USD;ETF;US;BEX;Desenvolvido;1
ARKF;ARK FINTECH INNOVATION ETF;ARKF;USD;ETF;US;NYSENAT;Desenvolvido;1
ARKG;ARK GENOMIC REVOLUTION ETF;ARKG;USD;ETF;US;IEX;Desenvolvido;1
ARKK;ARK INNOVATION ETF;ARKK;USD;ETF;US;MEMX;Desenvolvido;1
ARKQ;ARK AUTONOMOUS TECH & ROBOT;ARKQ;USD;ETF;US;AMEX;Desenvolvido;1
ARKW;ARK NEXT GENERATION INTERNET;ARKW;USD;ETF;US;PEARL;Desenvolvido;1
ARKX;ARK SPACE EXPLORATION & INNO;ARKX;USD;ETF;US;DRCTEDGE;Desenvolvido;1
ARKY;ARK 21SHRS ACTBITC ETH STRGY;ARKY;USD;ETF;US;IBEOS;Desenvolvido;1
ARKZ;ARK 21 SHARES ACT ETH F S;ARKZ;USD;ETF;US;BEX;Desenvolvido;1
ARLU;ALLIANZIM US BF15 UNCAP APR;ARLU;USD;ETF;US;DRCTEDGE;Desenvolvido;1
ARP;PMV ADAPTIVE RISK PARITY ETF;ARP;USD;ETF;US;IEX;Desenvolvido;1
ARTY;ISHARES FUTURE AI & TECH ETF;ARTY;USD;ETF;US;ISE;Desenvolvido;1
ARVR;FIRST TRUST INDXX METAVERSE;ARVR;USD;ETF;US;BEX;Desenvolvido;1
ASEA;GLOBAL X FTSE SOUTHEAST ASIA;ASEA;USD;ETF;US;EDGEA;Desenvolvido;1
ASET;FLEXSHARES REAL ASSETS FUND;ASET;USD;ETF;US;NYSENAT;Desenvolvido;1
ASHR;XTRACKERS HARVEST CSI 300 CH;ASHR;USD;ETF;US;ISLAND;Desenvolvido;1
ASHR;XTRACKERS HARVEST CSI 300 CH;ASHR;MXN;ETF;US;MEXI*;Desenvolvido;0
ASHS;XTRACKERS HARVEST CSI 500 CH;ASHS;USD;ETF;US;PEARL;Desenvolvido;1
ASHS;XTRACKERS HARVEST CSI 500 CH;ASHS;MXN;ETF;US;MEXI*;Desenvolvido;0
ASIA;MATTHEWS PACIFIC TIGER ETF;ASIA;USD;ETF;US;BEX;Desenvolvido;1
ASMF;VIRTUS AS FUTURES ETF;ASMF;USD;ETF;US;DRCTEDGE;Desenvolvido;1
ATFV;ALGER 35 ETF;ATFV;USD;ETF;US;AMEX;Desenvolvido;1
ATMP;IPATH SELECT MLP ETN;ATMP;USD;ETF;US;BEX;Desenvolvido;1
AUGM;FT VEST US EQ MAX BUF AUG;AUGM;USD;ETF;US;IEX;Desenvolvido;1
AUGP;PGIM US L-C BUF 12 ETF - AUG;AUGP;USD;ETF;US;IEX;Desenvolvido;1
AUGT;ALLIANZIM US LC BUFFER10 AUG;AUGT;USD;ETF;US;EDGEA;Desenvolvido;1
AUGU;ALLIANZIM US BF15 UNCAP AUG;AUGU;USD;ETF;US;EDGEA;Desenvolvido;1
AUGW;ALLIANZIM US LC BUFFER20 AUG;AUGW;USD;ETF;US;ISE;Desenvolvido;1
AUGZ;TRUESHARES STRUC OUT AUG ETF;AUGZ;USD;ETF;US;MEMX;Desenvolvido;1
AUMI;THEMES GOLD MINERS ETF;AUMI;USD;ETF;US;NASDAQ*;Desenvolvido;1
AUSF;GLOBAL X ADAPTIVE US FACTOR;AUSF;USD;ETF;US;BEX;Desenvolvido;1
AUSF;GLOBAL X ADAPTIVE US FACTOR;AUSF;MXN;ETF;US;MEXI*;Desenvolvido;0
AVDE;AVANTIS INTERNATIONAL EQUITY;AVDE;USD;ETF;US;DRCTEDGE;Desenvolvido;1
AVDS;AVANTIS INTL SM CAP EQ ETF;AVDS;USD;ETF;US;MEMX;Desenvolvido;1
AVDV;AVANTIS INTL S/C VALUE ETF;AVDV;USD;ETF;US;AMEX;Desenvolvido;1
AVEE;AVANTIS EM MKT SM CAP EQ ETF;AVEE;USD;ETF;US;EDGEA;Desenvolvido;1
AVEM;AVANTIS EMERGING MARKETS EQ;AVEM;USD;ETF;US;MEMX;Desenvolvido;1
AVES;AVANTIS EMERGING MARKETS VAL;AVES;USD;ETF;US;AMEX;Desenvolvido;1
AVGE;AVANTIS ALL EQTY MRKTS ETF;AVGE;USD;ETF;US;CBOE;Desenvolvido;1
AVGV;AVANTIS ALL EQ MKTS VAL ETF;AVGV;USD;ETF;US;MEMX;Desenvolvido;1
AVGX;DEFIANCE DLY TRG 2X LNG AVGO;AVGX;USD;ETF;US;NYSE;Desenvolvido;1
AVIE;AVANTIS INFLATION FOC EQ ETF;AVIE;USD;ETF;US;ARCA*;Desenvolvido;1
AVIG;AVANTIS CORE FIXED INCOME;AVIG;USD;ETF;US;EDGEA;Desenvolvido;1
AVIV;AVANTIS INT LRG CAP VAL ETF;AVIV;USD;ETF;US;CHX;Desenvolvido;1
AVL;DX DAILY AVGO BULL 2X SHS;AVL;USD;ETF;US;BEX;Desenvolvido;1
AVLC;AVANTIS US LG CAP EQ ETF;AVLC;USD;ETF;US;AMEX;Desenvolvido;1
AVLV;AVANTIS US LARGE CAP VALUE;AVLV;USD;ETF;US;EDGEA;Desenvolvido;1
AVMA;AVANTIS MOD ALLOC ETF;AVMA;USD;ETF;US;IEX;Desenvolvido;1
AVMC;AVANTIS US MID CAP EQ ETF;AVMC;USD;ETF;US;EDGEA;Desenvolvido;1
AVMU;AVANTIS CORE MUNICIPAL FIXED;AVMU;USD;ETF;US;DRCTEDGE;Desenvolvido;1
AVMV;AVANTIS US MID CAP VAL ETF;AVMV;USD;ETF;US;DRCTEDGE;Desenvolvido;1
AVNM;AVANTIS ALL INTL MKTS EQ ETF;AVNM;USD;ETF;US;NYSENAT;Desenvolvido;1
AVNV;AVANTIS ALL INTL MKT VAL ETF;AVNV;USD;ETF;US;ISE;Desenvolvido;1
AVRE;AVANTIS REAL ESTATE ETF;AVRE;USD;ETF;US;DRCTEDGE;Desenvolvido;1
AVS;DX DAILY AVGO BEAR 1X SHS;AVS;USD;ETF;US;ARCA;Desenvolvido;1
AVSC;AVANTIS US SMALL CAP EQUITY;AVSC;USD;ETF;US;DRCTEDGE;Desenvolvido;1
AVSD;AVANTIS REPS INTERN EQUI ETF;AVSD;USD;ETF;US;IBEOS;Desenvolvido;1
AVSE;AVANTIS RESP EMERG MKTS EQ-E;AVSE;USD;ETF;US;EDGEA;Desenvolvido;1
AVSF;AVANTIS SHORT-TERM FIXED INC;AVSF;USD;ETF;US;MEMX;Desenvolvido;1
AVSU;AVANTIS RESP US EQUITY ETF;AVSU;USD;ETF;US;EDGEA;Desenvolvido;1
AVUS;AVANTIS U.S. EQUITY ETF;AVUS;USD;ETF;US;MEMX;Desenvolvido;1
AVUV;AVANTIS US SMALL CAP VALUE;AVUV;USD;ETF;US;IEX;Desenvolvido;1
AVXC;AVANTIS EMG MKT EX CHINA ETF;AVXC;USD;ETF;US;CHX;Desenvolvido;1
AWAY;AMPLIFY TRAVEL TECH ETF;AWAY;USD;ETF;US;DRCTEDGE;Desenvolvido;1
AWEG;ALGER WEATHERBIE ENDURING GR;AWEG;USD;ETF;US;AMEX;Desenvolvido;1
AZNH;ASTRAZENECA PLC ADRHEDGED;AZNH;USD;ETF;US;AMEX;Desenvolvido;1
AZTD;AZTLAN GLB STPCL SEL DM SMID;AZTD;USD;ETF;US;PHLX;Desenvolvido;1
AZTD;AZTLAN GLB STPCL SEL DM SMID;AZTD;MXN;ETF;US;MEXI*;Desenvolvido;0
BAB;INVESCO TAXABLE MUNICIPAL BO;BAB;USD;ETF;US;BEX;Desenvolvido;1
BABO;YIELDMAX BABA OPT INC ST ETF;BABO;USD;ETF;US;DRCTEDGE;Desenvolvido;1
BABX;GRANITESH 2XLNG BABA ETF-USD;BABX;USD;ETF;US;LTSE;Desenvolvido;1
BAFE;BROWN FLEX EQUITY ETF;BAFE;USD;ETF;US;NASDAQ*;Desenvolvido;1
BAI;ISHRS AI IN AND TECH ACT ETF;BAI;USD;ETF;US;IEX;Desenvolvido;1
BALI;ISHRS ADTG LG CP IN ETF-USDI;BALI;USD;ETF;US;DRCTEDGE;Desenvolvido;1
BALT;INN DEFINED WEALTH SHIELD;BALT;USD;ETF;US;PSX;Desenvolvido;1
BAMA;BROOKSTONE ACTIVE ETF;BAMA;USD;ETF;US;ARCA;Desenvolvido;1
BAMB;BROOKSTONE INTERMD BOND ETF;BAMB;USD;ETF;US;ARCA;Desenvolvido;1
BAMD;BROOKSTONE DIV STOCK ETF;BAMD;USD;ETF;US;AMEX;Desenvolvido;1
BAMG;BROOKSTONE GROWTH STOCK ETF;BAMG;USD;ETF;US;ARCA;Desenvolvido;1
BAMO;BROOKSTONE OPPORTUNITIES ETF;BAMO;USD;ETF;US;DRCTEDGE;Desenvolvido;1
BAMU;BROOKSTONE ULTRASHRT BND ETF;BAMU;USD;ETF;US;NYSENAT;Desenvolvido;1
BAMV;BROOKSTONE VALUE STOCK ETF;BAMV;USD;ETF;US;AMEX;Desenvolvido;1
BAMY;BROOKSTONE YIELD ETF;BAMY;USD;ETF;US;BATS*;Desenvolvido;1
BAPR;INNOVATOR U.S. EQUITY BUFFER;BAPR;USD;ETF;US;EDGEA;Desenvolvido;1
BAR;GRANITESHARES GOLD TRUST;BAR;USD;ETF;US;OVERNIGHT;Desenvolvido;1
BATT;AMPLIFY LITHIUM & BATTERY TECH;BATT;USD;ETF;US;IBEOS;Desenvolvido;1
BAUG;INNOVATOR U.S. EQUITY BUFFER;BAUG;USD;ETF;US;EDGEA;Desenvolvido;1
BBAG;JPMORGAN BETABUILDERS US AGG;BBAG;USD;ETF;US;EDGEA;Desenvolvido;1
BBAG;JPMORGAN BETABUILDERS US AGG;BBAG;MXN;ETF;US;MEXI*;Desenvolvido;0
BBAX;JPMORGAN BETABUILDERS DEVELO;BBAX;USD;ETF;US;DRCTEDGE;Desenvolvido;1
BBAX;JPMORGAN BETABUILDERS DEVELO;BBAX;MXN;ETF;US;MEXI*;Desenvolvido;0
BBBI;BBLX BBB 5-10Y CORPBOND ETF;BBBI;USD;ETF;US;AMEX;Desenvolvido;1
BBBL;BBLX BBB 10+Y CORP BOND ETF;BBBL;USD;ETF;US;BEX;Desenvolvido;1
BBBS;BBLX BBB 1-5Y CORP BOND ETF;BBBS;USD;ETF;US;PEARL;Desenvolvido;1
BBC;VIRTUS LIFESCI BIOTECH CLINI;BBC;USD;ETF;US;AMEX;Desenvolvido;1
BBCA;JPMORGAN BETABUILDERS CANADA;BBCA;USD;ETF;US;IEX;Desenvolvido;1
BBCA;JPMORGAN BETABUILDERS CANADA;BBCA;MXN;ETF;US;MEXI*;Desenvolvido;0
BBCB;JPMORGAN BETABUILDERS USD IN;BBCB;USD;ETF;US;LTSE;Desenvolvido;1
BBCB;JPMORGAN BETABUILDERS USD IN;BBCB;MXN;ETF;US;MEXI*;Desenvolvido;0
BBEM;JPMORGAN BETABUILDERS EM EQT;BBEM;USD;ETF;US;DRCTEDGE;Desenvolvido;1
BBEM;JPMORGAN BETABUILDERS EM EQT;BBEM;MXN;ETF;US;MEXI*;Desenvolvido;0
BBEU;JPMORGAN BETABUILDERS EUROPE;BBEU;MXN;ETF;US;MEXI*;Desenvolvido;0
BBEU;JPMORGAN BETABUILDERS EUROPE;BBEU;USD;ETF;US;DRCTEDGE;Desenvolvido;1
BBH;VANECK BIOTECH ETF;BBH;USD;ETF;US;PSX;Desenvolvido;1
BBHY;JPMORGAN BETABUILDERS USD HI;BBHY;USD;ETF;US;ISLAND;Desenvolvido;1
BBHY;JPMORGAN BETABUILDERS USD HI;BBHY;MXN;ETF;US;MEXI*;Desenvolvido;0
BBIB;JPM BETA US TR 3-10 YR ETF;BBIB;USD;ETF;US;NYSENAT;Desenvolvido;1
BBIB;JPM BETA US TR 3-10 YR ETF;BBIB;MXN;ETF;US;MEXI*;Desenvolvido;0
BBIN;JPM BETABUILDERS INTL EQTY;BBIN;USD;ETF;US;DRCTEDGE;Desenvolvido;1
BBIN;JPM BETABUILDERS INTL EQTY;BBIN;MXN;ETF;US;MEXI*;Desenvolvido;0
BBIP;JPM BETA US TR 0-5 YR ETF;BBIP;MXN;ETF;US;MEXI*;Desenvolvido;0
BBJP;JPMORGAN BETABUILDERS JAPAN;BBJP;MXN;ETF;US;MEXI*;Desenvolvido;0
BBJP;JPMORGAN BETABUILDERS JAPAN;BBJP;USD;ETF;US;AMEX;Desenvolvido;1
BBLB;JPM BETA US TR 20+ YR ETF;BBLB;USD;ETF;US;ARCA;Desenvolvido;1
BBLB;JPM BETA US TR 20+ YR ETF;BBLB;MXN;ETF;US;MEXI*;Desenvolvido;0
BBLU;EA BRIDGEWAY BLUE CHIP ETF;BBLU;USD;ETF;US;EDGEA;Desenvolvido;1
BBMC;JPM BETABUILDERS US MID CAP;BBMC;USD;ETF;US;AMEX;Desenvolvido;1
BBMC;JPM BETABUILDERS US MID CAP;BBMC;MXN;ETF;US;MEXI*;Desenvolvido;0
BBP;VIRTUS LIFESCI BIOTECH PRODU;BBP;USD;ETF;US;AMEX;Desenvolvido;1
BBRE;JPM BETABLDRS MSCI US REIT;BBRE;USD;ETF;US;PHLX;Desenvolvido;1
BBRE;JPM BETABLDRS MSCI US REIT;BBRE;MXN;ETF;US;MEXI*;Desenvolvido;0
BBSA;JPMORGAN BETABUILDERS 1-5 YR;BBSA;MXN;ETF;US;MEXI*;Desenvolvido;0
BBSB;JPM BETA US TR 1-3 YR ETF;BBSB;USD;ETF;US;LTSE;Desenvolvido;1
BBSB;JPM BETA US TR 1-3 YR ETF;BBSB;MXN;ETF;US;MEXI*;Desenvolvido;0
BBSC;JPMORGAN BETABUILDERS US SC;BBSC;USD;ETF;US;LTSE;Desenvolvido;1
BBSC;JPMORGAN BETABUILDERS US SC;BBSC;MXN;ETF;US;MEXI*;Desenvolvido;0
BBUS;JPMORGAN BETABUILDERS US EQU;BBUS;USD;ETF;US;MEMX;Desenvolvido;1
BBUS;JPMORGAN BETABUILDERS US EQU;BBUS;MXN;ETF;US;MEXI*;Desenvolvido;0
BCD;ABRDN BLOOMBERG ALL COMMODIT;BCD;USD;ETF;US;CHX;Desenvolvido;1
BCDF;HORIZON KIN BLOCKCHAIN DEV;BCDF;USD;ETF;US;EDGEA;Desenvolvido;1
BCHP;PRINCIPAL FOC BLUE CHIP ETF;BCHP;USD;ETF;US;AMEX;Desenvolvido;1
BCI;ABRDN BLOOMBERG ALL COMMODIT;BCI;USD;ETF;US;PEARL;Desenvolvido;1
BCIL;BANCREEK INTERL LARG ETF;BCIL;USD;ETF;US;AMEX;Desenvolvido;1
BCIM;ABRDN BLOOMBERG INDUSTRIAL M;BCIM;USD;ETF;US;BATS;Desenvolvido;1
BCUS;BANCREEK U.S. LARGE CAP ETF;BCUS;USD;ETF;US;EDGEA;Desenvolvido;1
BDCX;ETRACS QUARTERLY PAY 1.5X LE;BDCX;USD;ETF;US;EDGEA;Desenvolvido;1
BDCZ;ETRACS MARKETVECTOR BUSINESS;BDCZ;USD;ETF;US;LTSE;Desenvolvido;1
BDDXF;DB BASE METALS DOUBLE LONG;BDDXF;USD;ETF;US;OTCLNKECN;Desenvolvido;1
BDEC;INNOVATOR U.S. EQUITY BUFFER;BDEC;USD;ETF;US;LTSE;Desenvolvido;1
BDGS;BRIDGES CAPITAL TACT ETF;BDGS;USD;ETF;US;DRCTEDGE;Desenvolvido;1
BDIV;AAM BRENTVIEW DVD GROWTH ETF;BDIV;USD;ETF;US;LTSE;Desenvolvido;1
BDRY;BREAKWAVE DRY BULK SHIPPING;BDRY;USD;ETF;US;BEX;Desenvolvido;1
BDVG;IMGP BERKSHIRE DIVIDEND GR;BDVG;USD;ETF;US;BATS;Desenvolvido;1
BEDZ;ADVISORSHARES HOTEL ETF;BEDZ;USD;ETF;US;DRCTEDGE;Desenvolvido;1
BEEX;THE BEEHIVE ETF;BEEX;USD;ETF;US;LTSE;Desenvolvido;1
BEEZ;HONEYTREE US EQUITY ETF;BEEZ;USD;ETF;US;BEX;Desenvolvido;1
BELT;ISHARES LNG-TR US EQ ACT ETF;BELT;USD;ETF;US;AMEX;Desenvolvido;1
BEMB;ISHARES JPM BRD USD EM B ETF;BEMB;USD;ETF;US;BEX;Desenvolvido;1
BERZ;MICROSECTORS FANG & INN -3X;BERZ;USD;ETF;US;AMEX;Desenvolvido;1
BETE;PROSHRS BIT&ET E W ETF-USD I;BETE;USD;ETF;US;NYSENAT;Desenvolvido;1
BETH;PROSHARES BIT&ET MKT C W ETF;BETH;USD;ETF;US;LTSE;Desenvolvido;1
BETZ;ROUNDHILL SPORTS BET & IGAM;BETZ;USD;ETF;US;MEMX;Desenvolvido;1
BFEB;INNOVATOR U.S. EQUITY BUFFER;BFEB;USD;ETF;US;BEX;Desenvolvido;1
BFIX;BUILD BOND INNOVATION ETF;BFIX;USD;ETF;US;DRCTEDGE;Desenvolvido;1
BFOR;BARRON'S 400 ETF;BFOR;USD;ETF;US;LTSE;Desenvolvido;1
BGDV;BAHL & GAYNOR DIVIDEND ETF;BGDV;USD;ETF;US;BYX;Desenvolvido;1
BGIG;BAHL & GAYNOR INC GROWTH ETF;BGIG;USD;ETF;US;BEX;Desenvolvido;1
BGLD;FT VEST GOLD STRATEGY QUARTE;BGLD;USD;ETF;US;DRCTEDGE;Desenvolvido;1
BGRN;ISHARES USD GREEN BOND ETF;BGRN;USD;ETF;US;EDGEA;Desenvolvido;1
BGRO;ISHARES LRG CAP GRWT ACT ETF;BGRO;USD;ETF;US;DRCTEDGE;Desenvolvido;1
BHYB;XTRACKERS US HY BB-B EX FIN;BHYB;USD;ETF;US;AMEX;Desenvolvido;1
BIB;PROSHARES ULTRA NASD BIOTECH;BIB;USD;ETF;US;BEX;Desenvolvido;1
BIBL;INSPIRE 100 ETF;BIBL;USD;ETF;US;NYSE;Desenvolvido;1
BIDD;BLACKROCK INTL DIVIDEND ETF;BIDD;USD;ETF;US;AMEX;Desenvolvido;1
BIGY;YLDM TART 12 SMICD OPT I ETF;BIGY;USD;ETF;US;AMEX;Desenvolvido;1
BIL;SPDR BLOOMBERG 1-3 MONTH T-B;BIL;USD;ETF;US;ARCA*;Desenvolvido;1
BIL;SPDR BLOOMBERG 1-3 MONTH T-B;BIL;MXN;ETF;US;MEXI*;Desenvolvido;0
BILD;MACQUARIE GL INFRA ETF;BILD;USD;ETF;US;DRCTEDGE;Desenvolvido;1
BILS;SPDR BLOOMBERG 3-12 MONTH T-;BILS;USD;ETF;US;DRCTEDGE;Desenvolvido;1
BILS;SPDR BLOOMBERG 3-12 MONTH T-;BILS;MXN;ETF;US;MEXI*;Desenvolvido;0
BILZ;PIMCO ULTRA SHRT GOVT ACTIVE;BILZ;USD;ETF;US;CHX;Desenvolvido;1
BINC;ISHARES FLEX I A ETF-USD INC;BINC;USD;ETF;US;BEX;Desenvolvido;1
BINV;BRANDES INTERNATIONAL ETF;BINV;USD;ETF;US;AMEX;Desenvolvido;1
BIS;PROSHARES ULTRASHORT NAS BIO;BIS;USD;ETF;US;DRCTEDGE;Desenvolvido;1
BITB;BITWISE BITCOIN ETF;BITB;USD;ETF;US;BEX;Desenvolvido;1
BITC;BIT TRE BIT TRE RO ST ET-USD;BITC;USD;ETF;US;NYSE;Desenvolvido;1
BITI;PROSHARES SHORT BITC ETF-USD;BITI;USD;ETF;US;DRCTEDGE;Desenvolvido;1
BITO;PROSHARES BITCOIN ETF-USD;BITO;USD;ETF;US;AMEX;Desenvolvido;1
BITQ;BITWISE CRYPTO IND INNOV ETF;BITQ;USD;ETF;US;IEX;Desenvolvido;1
BITS;GLOBAL X BLOCK & BIT STRAT;BITS;USD;ETF;US;AMEX;Desenvolvido;1
BITU;PROSHARES ULTRA BITCOIN ETF;BITU;USD;ETF;US;DRCTEDGE;Desenvolvido;1
BITX;2X BITCOIN STRATEGY ETF;BITX;USD;ETF;US;PHLX;Desenvolvido;1
BIV;VANGUARD INTERMEDIATE-TERM B;BIV;USD;ETF;US;MEMX;Desenvolvido;1
BIZD;VANECK BDC INCOME ETF;BIZD;USD;ETF;US;EDGEA;Desenvolvido;1
BJAN;INNOVATOR U.S. EQUITY BUFFER;BJAN;USD;ETF;US;IBEOS;Desenvolvido;1
BJK;VANECK GAMING ETF;BJK;USD;ETF;US;NYSENAT;Desenvolvido;1
BJUL;INNOVATOR U.S. EQUITY BUFFER;BJUL;USD;ETF;US;CHX;Desenvolvido;1
BJUN;INNOVATOR U.S. EQUITY BUFFER;BJUN;USD;ETF;US;EDGEA;Desenvolvido;1
BKAG;BNY MELLON CORE BOND ETF;BKAG;USD;ETF;US;DRCTEDGE;Desenvolvido;1
BKCH;GLOBAL X BLOCKCHAIN ETF;BKCH;USD;ETF;US;PHLX;Desenvolvido;1
BKCH;GLOBAL X BLOCKCHAIN ETF;BKCH;MXN;ETF;US;MEXI*;Desenvolvido;0
BKCI;BNY MELLON CONCENTRATED INTL;BKCI;USD;ETF;US;NYSE;Desenvolvido;1
BKDV;BNY MELLON DYNAMIC VALUE;BKDV;USD;ETF;US;BEX;Desenvolvido;1
BKEM;BNY MELLON EMRG MRKTS EQTY;BKEM;USD;ETF;US;ARCA*;Desenvolvido;1
BKF;ISHARES MSCI BIC ETF;BKF;USD;ETF;US;DRCTEDGE;Desenvolvido;1
BKF;ISHARES MSCI BIC ETF;BKF;MXN;ETF;US;MEXI*;Desenvolvido;0
BKGI;BNY MELLON GLBL INFRA INC;BKGI;USD;ETF;US;IEX;Desenvolvido;1
BKHY;BNY MELLON HIGH YIELD ETF;BKHY;USD;ETF;US;EDGEA;Desenvolvido;1
BKIE;BNY MELLON INTL EQTY ETF;BKIE;USD;ETF;US;LTSE;Desenvolvido;1
BKIV;BNY MELLON INNOVATORS ETF;BKIV;USD;ETF;US;EDGEA;Desenvolvido;1
BKLC;BNY MELLON US LRG CAP COR;BKLC;USD;ETF;US;MEMX;Desenvolvido;1
BKLN;INVESCO SENIOR LOAN ETF;BKLN;USD;ETF;US;AMEX;Desenvolvido;1
BKMC;BNY MELLON US M/C CORE ETF;BKMC;USD;ETF;US;IBEOS;Desenvolvido;1
BKSE;BNY MELLON US SMALL CAP CORE;BKSE;USD;ETF;US;EDGEA;Desenvolvido;1
BKUI;BNY MELLON ULTR SHRT INC ETF;BKUI;USD;ETF;US;DRCTEDGE;Desenvolvido;1
BKWO;BNY MELLON WOMEN'S OPP ETF;BKWO;USD;ETF;US;AMEX;Desenvolvido;1
BLCN;SIREN NEXGEN ECONOMY ETF;BLCN;USD;ETF;US;ARCA;Desenvolvido;1
BLCR;ISHARES LRG CP CR ACT ETF-UI;BLCR;USD;ETF;US;LTSE;Desenvolvido;1
BLCV;ISHARES LRG CP VU ACT ETF-UI;BLCV;USD;ETF;US;CHX;Desenvolvido;1
BLDG;CAMBRIA GLOBAL REAL ESTATE;BLDG;USD;ETF;US;MEMX;Desenvolvido;1
BLES;INSPIRE GLOBAL HOPE ETF;BLES;USD;ETF;US;BEX;Desenvolvido;1
BLKC;INVESCO ALERIAN GALAXY BLOCK;BLKC;USD;ETF;US;IEX;Desenvolvido;1
BLLD;JPMORGAN SUSTAINABLE INFRA;BLLD;USD;ETF;US;AMEX;Desenvolvido;1
BLOK;AMPLIFY TRANSFOR DATA SHARIN;BLOK;USD;ETF;US;BEX;Desenvolvido;1
BLV;VANGUARD LONG-TERM BOND ETF;BLV;USD;ETF;US;AMEX;Desenvolvido;1
BLV;VANGUARD LONG-TERM BOND ETF;BLV;MXN;ETF;US;MEXI*;Desenvolvido;0
BMAR;INNOVATOR U.S. EQUITY BUFFER;BMAR;USD;ETF;US;IEX;Desenvolvido;1
BMAY;INNOVATOR U.S. EQUITY BUFFER;BMAY;USD;ETF;US;MEMX;Desenvolvido;1
BMDL;VS WE ECON CYCLE BOND ETF;BMDL;USD;ETF;US;AMEX;Desenvolvido;1
BMED;ISHARES HEA IN A ETF-USD INC;BMED;USD;ETF;US;BEX;Desenvolvido;1
BMVP;INVESCO BLOOMBERG MVP MULTI-;BMVP;USD;ETF;US;DRCTEDGE;Desenvolvido;1
BND;VANGUARD TOTAL BOND MARKET;BND;USD;ETF;US;EDGEA;Desenvolvido;1
BNDC;FLEXSHARES CORE SELECT BOND;BNDC;USD;ETF;US;NYSE;Desenvolvido;1
BNDD;QUADRATIC DEFLATION ETF;BNDD;USD;ETF;US;IEX;Desenvolvido;1
BNDI;NEOS ENHANCED INC AGG BD ETF;BNDI;USD;ETF;US;ARCA*;Desenvolvido;1
BNDW;VANGUARD TOTAL WORLD BOND ET;BNDW;USD;ETF;US;ARCA;Desenvolvido;1
BNDW;VANGUARD TOTAL WORLD BOND ET;BNDW;MXN;ETF;US;MEXI*;Desenvolvido;0
