SYMBOL;DESCRIPTION;IBKR SYMBOL;CURRENCY;PRODUCT;REGION;EXCHANGE *PRIMARY EXCHANGE;Classificação Econômica;inloco
FSCS;FIRST TRUST SMID CAPITAL STR;FSCS;USD;ETF;US;OVERNIGHT;Desenvolvido;1
FSEC;FIDELITY INV GRADE SECURIT;FSEC;USD;ETF;US;NYSENAT;Desenvolvido;1
FSEP;FT VEST U.S. EQUITY BUFFER E;FSEP;USD;ETF;US;BYX;Desenvolvido;1
FSGS;FIRST TRUST SMID GROWTH STRE;FSGS;USD;ETF;US;BATS;Desenvolvido;1
FSIG;FT LTD DURATION INV GRADE;FSIG;USD;ETF;US;LTSE;Desenvolvido;1
FSLD;FIDELITY SUST LOW DUR ETF;FSLD;USD;ETF;US;BEX;Desenvolvido;1
FSMB;FIRST TRUST SHORT DUR MANAG;FSMB;USD;ETF;US;PSX;Desenvolvido;1
FSMD;FIDELITY SMALL-MID MULTIFACT;FSMD;USD;ETF;US;DRCTEDGE;Desenvolvido;1
FSST;FIDELITY SUSTAINABLE U.S. EQ;FSST;USD;ETF;US;DRCTEDGE;Desenvolvido;1
FSTA;FIDELITY CON STAPLES ETF;FSTA;USD;ETF;US;BEX;Desenvolvido;1
FSYD;FIDELITY SUSTAINABLE HY ETF;FSYD;USD;ETF;US;BEX;Desenvolvido;1
FSZ;FIRST TRUST SWITZERLAND;FSZ;USD;ETF;US;BEX;Desenvolvido;1
FTA;FIRST TRUST L C VAL ALP;FTA;USD;ETF;US;NASDAQ*;Desenvolvido;1
FTA;FIRST TRUST L C VAL ALP;FTA;MXN;ETF;US;MEXI*;Desenvolvido;0
FTAG;FIRST TRUST INDXX GLOBAL AGR;FTAG;USD;ETF;US;IEX;Desenvolvido;1
FTBD;FIDELITY TACTICAL BOND ETF;FTBD;USD;ETF;US;BEX;Desenvolvido;1
FTC;FIRST TRUST LARGE CAP GROWTH;FTC;USD;ETF;US;BATS;Desenvolvido;1
FTC;FIRST TRUST LARGE CAP GROWTH;FTC;MXN;ETF;US;MEXI*;Desenvolvido;0
FTCB;FT CORE INVESTMENT GRADE ETF;FTCB;USD;ETF;US;LTSE;Desenvolvido;1
FTCE;FT NEW CONSTRUCT CORE EARN L;FTCE;USD;ETF;US;DRCTEDGE;Desenvolvido;1
FTCS;FIRST TRUST CAPITAL STRENGTH;FTCS;USD;ETF;US;EDGEA;Desenvolvido;1
FTCS;FIRST TRUST CAPITAL STRENGTH;FTCS;MXN;ETF;US;MEXI*;Desenvolvido;0
FTDS;FIRST TRUST DIVIDEND STRENGT;FTDS;USD;ETF;US;IBEOS;Desenvolvido;1
FTEC;FIDELITY MSCI INFO TECH ETF;FTEC;USD;ETF;US;PSX;Desenvolvido;1
FTGC;FIRST TRUST GLOBAL TACTICAL;FTGC;USD;ETF;US;NASDAQ*;Desenvolvido;1
FTGS;FIRST TRUST GRWTH STRGTH ETF;FTGS;USD;ETF;US;AMEX;Desenvolvido;1
FTHF;FT EM HUMAN FLOURISHING ETF;FTHF;USD;ETF;US;ARCA*;Desenvolvido;1
FTHI;FTHI/FIRST TRUST EXCHANGE-TR;FTHI;USD;ETF;US;BEX;Desenvolvido;1
FTIF;FT BBG INFL SENSITIVE EQ ETF;FTIF;USD;ETF;US;IEX;Desenvolvido;1
FTLS;FIRST TRUST LONG/SHORT EQTY;FTLS;USD;ETF;US;AMEX;Desenvolvido;1
FTQI;FIRST TRUST NASDAQ BUYWRITE;FTQI;USD;ETF;US;BEX;Desenvolvido;1
FTRB;FEDERATED HERM TTL RTRN BND;FTRB;USD;ETF;US;CHX;Desenvolvido;1
FTRI;FIRST TRUST INDXX GLOBAL NAT;FTRI;USD;ETF;US;AMEX;Desenvolvido;1
FTSD;FRANKLIN SHORT DURATION U.S.;FTSD;USD;ETF;US;MEMX;Desenvolvido;1
FTSL;FIRST TRUST SENIOR LOAN ETF;FTSL;USD;ETF;US;DRCTEDGE;Desenvolvido;1
FTSM;FIRST TRUST ENH SHORT MAT FD;FTSM;USD;ETF;US;BEX;Desenvolvido;1
FTWO;STRIVE NATURAL RESOURCES AND;FTWO;USD;ETF;US;DRCTEDGE;Desenvolvido;1
FTXG;FIRST TRUST NASDAQ FOOD & BE;FTXG;USD;ETF;US;BEX;Desenvolvido;1
FTXH;FIRST TRUST NASDAQ PHARMACEU;FTXH;USD;ETF;US;IEX;Desenvolvido;1
FTXL;FIRST TRUST NASDAQ SEMICONDU;FTXL;USD;ETF;US;PHLX;Desenvolvido;1
FTXN;FIRST TRUST NASDAQ OIL & GAS;FTXN;USD;ETF;US;IEX;Desenvolvido;1
FTXO;FIRST TRUST NASDAQ BANK ETF;FTXO;USD;ETF;US;PSX;Desenvolvido;1
FTXO;FIRST TRUST NASDAQ BANK ETF;FTXO;MXN;ETF;US;MEXI*;Desenvolvido;0
FTXR;FIRST TRUST NASDAQ TRANSPORT;FTXR;USD;ETF;US;NYSE;Desenvolvido;1
FUMB;FIRST TRUST ULTRA SHORT DUR;FUMB;USD;ETF;US;DRCTEDGE;Desenvolvido;1
FUNL;CORNERCAP FUNDAMETR LRG CAP;FUNL;USD;ETF;US;BEX;Desenvolvido;1
FUSI;AM CENT MULTISECT FLOAT INC;FUSI;USD;ETF;US;NYSENAT;Desenvolvido;1
FUTY;FIDELITY US UTILITIES ETF;FUTY;USD;ETF;US;EDGEA;Desenvolvido;1
FV;FIRST TRUST DW FOCUS 5 FUND;FV;USD;ETF;US;NYSENAT;Desenvolvido;1
FV;FIRST TRUST DW FOCUS 5 FUND;FV;MXN;ETF;US;MEXI*;Desenvolvido;0
FVAL;FIDELITY VALUE FACTOR ETF;FVAL;USD;ETF;US;NYSENAT;Desenvolvido;1
FVC;FIRST TRUST DORSEY WRIGHT DY;FVC;USD;ETF;US;DRCTEDGE;Desenvolvido;1
FVD;FIRST TRUST VALUE LINE DVD;FVD;USD;ETF;US;ARCA*;Desenvolvido;1
FVD;FIRST TRUST VALUE LINE DVD;FVD;MXN;ETF;US;MEXI*;Desenvolvido;0
FWD;AB DISRUPTORS ETF;FWD;USD;ETF;US;IBEOS;Desenvolvido;1
FXA;INVESCO CURRENCYSHARES AUSTR;FXA;USD;ETF;US;AMEX;Desenvolvido;1
FXB;INVESCO CURRENCYSHARES BRITI;FXB;USD;ETF;US;ARCA*;Desenvolvido;1
FXC;INVESCO CURRENCYSHARES CANAD;FXC;USD;ETF;US;LTSE;Desenvolvido;1
FXC;INVESCO CURRENCYSHARES CANAD;FXC;MXN;ETF;US;MEXI*;Desenvolvido;0
FXD;FIRST TRUST CONSUMER DISCRET;FXD;USD;ETF;US;ARCA*;Desenvolvido;1
FXD;FIRST TRUST CONSUMER DISCRET;FXD;MXN;ETF;US;MEXI*;Desenvolvido;0
FXE;INVESCO CURRENCYSHARES EURO;FXE;USD;ETF;US;AMEX;Desenvolvido;1
FXED;SOUND ENHANCED FIXED INCOME;FXED;USD;ETF;US;AMEX;Desenvolvido;1
FXF;INVESCO CURRENCYSHARES SWISS;FXF;USD;ETF;US;CBOE;Desenvolvido;1
FXG;FIRST TRUST CONSUMER STAPLES;FXG;USD;ETF;US;PEARL;Desenvolvido;1
FXG;FIRST TRUST CONSUMER STAPLES;FXG;MXN;ETF;US;MEXI*;Desenvolvido;0
FXH;FIRST TRUST HEALTH CARE ALPH;FXH;USD;ETF;US;CHX;Desenvolvido;1
FXH;FIRST TRUST HEALTH CARE ALPH;FXH;MXN;ETF;US;MEXI*;Desenvolvido;0
FXI;ISHARES CHINA LARGE-CAP ETF;FXI;USD;ETF;US;AMEX;Desenvolvido;1
FXI;ISHARES CHINA LARGE-CAP ETF;FXI;MXN;ETF;US;MEXI*;Desenvolvido;0
FXL;FIRST TRUST TECHNOLOGY ALPHA;FXL;USD;ETF;US;AMEX;Desenvolvido;1
FXL;FIRST TRUST TECHNOLOGY ALPHA;FXL;MXN;ETF;US;MEXI*;Desenvolvido;0
FXN;FIRST TRUST ENERGY ALPHADEX;FXN;USD;ETF;US;LTSE;Desenvolvido;1
FXN;FIRST TRUST ENERGY ALPHADEX;FXN;MXN;ETF;US;MEXI*;Desenvolvido;0
FXO;FIRST TRUST FINANCIAL ALPHAD;FXO;USD;ETF;US;DRCTEDGE;Desenvolvido;1
FXO;FIRST TRUST FINANCIAL ALPHAD;FXO;MXN;ETF;US;MEXI*;Desenvolvido;0
FXP;PROSHARES ULTRASHORT FTSE CH;FXP;USD;ETF;US;MEMX;Desenvolvido;1
FXR;FIRST TRUST INDST/PRODUCERS;FXR;USD;ETF;US;OVERNIGHT;Desenvolvido;1
FXR;FIRST TRUST INDST/PRODUCERS;FXR;MXN;ETF;US;MEXI*;Desenvolvido;0
FXU;FIRST TRUST UTILITIES ALPHAD;FXU;USD;ETF;US;DRCTEDGE;Desenvolvido;1
FXU;FIRST TRUST UTILITIES ALPHAD;FXU;MXN;ETF;US;MEXI*;Desenvolvido;0
FXY;INVESCO CURRENCYSHARES JAPAN;FXY;USD;ETF;US;AMEX;Desenvolvido;1
FXZ;FIRST TRUST MATERIALS ALPHAD;FXZ;USD;ETF;US;DRCTEDGE;Desenvolvido;1
FXZ;FIRST TRUST MATERIALS ALPHAD;FXZ;MXN;ETF;US;MEXI*;Desenvolvido;0
FYC;FIRST TRUST SMALL CAP GROWTH;FYC;USD;ETF;US;IEX;Desenvolvido;1
FYC;FIRST TRUST SMALL CAP GROWTH;FYC;MXN;ETF;US;MEXI*;Desenvolvido;0
FYEE;FIDELITY YIELD ENHANCED EQTY;FYEE;USD;ETF;US;EDGEA;Desenvolvido;1
FYLD;CAMBRIA FOREIGN SHAREHOLDER;FYLD;USD;ETF;US;PHLX;Desenvolvido;1
FYLG;GLOBAL X FIN COV CALL & GR;FYLG;USD;ETF;US;EDGX;Desenvolvido;1
FYLG;GLOBAL X FIN COV CALL & GR;FYLG;MXN;ETF;US;MEXI*;Desenvolvido;0
FYT;FIRST TRUST SMALL CAP VAL;FYT;USD;ETF;US;LTSE;Desenvolvido;1
FYX;FIRST TRUST SMALL CAP CORE A;FYX;USD;ETF;US;DRCTEDGE;Desenvolvido;1
FYX;FIRST TRUST SMALL CAP CORE A;FYX;MXN;ETF;US;MEXI*;Desenvolvido;0
GAA;CAMBRIA GLOBAL ASSET ALLOCAT;GAA;USD;ETF;US;CHX;Desenvolvido;1
GABF;GABELLI FIN SRVCS OPP ETF;GABF;USD;ETF;US;LTSE;Desenvolvido;1
GAEM;SIMPLIFY GAMMA EM BOND ETF;GAEM;USD;ETF;US;BEX;Desenvolvido;1
GAL;SPDR SSGA GLOBAL ALLOCATION;GAL;USD;ETF;US;PSX;Desenvolvido;1
GAMR;AMPLIFY VIDEO GAME TECH ETF;GAMR;USD;ETF;US;DRCTEDGE;Desenvolvido;1
GAPR;FT VEST US EQUITY MODERATE B;GAPR;USD;ETF;US;EDGEA;Desenvolvido;1
GARP;ISHARES MSCI USA QUALITY GAR;GARP;USD;ETF;US;NYSE;Desenvolvido;1
GAST;GABELLI AUTOMATION ETF;GAST;USD;ETF;US;NYSENAT;Desenvolvido;1
GAUG;FT VEST US EQUITY MODERATE B;GAUG;USD;ETF;US;BEX;Desenvolvido;1
GBF;ISHARES GOVERNMENT/CREDIT BO;GBF;USD;ETF;US;CHX;Desenvolvido;1
GBIL;GOLDMAN SACHS ACCESS TREASUR;GBIL;USD;ETF;US;ARCA*;Desenvolvido;1
GBLD;INVESCO MSCI BUILDING ETF;GBLD;USD;ETF;US;EDGEA;Desenvolvido;1
GBTC;GRAYSCALE BITCOIN TRUST ETF;GBTC;USD;ETF;US;EDGEA;Desenvolvido;1
GBUY;GOLDMAN SACHS FUT CONSUMER;GBUY;USD;ETF;US;IEX;Desenvolvido;1
GBXA;GOLDMAN SACHS US LC BUFF 1;GBXA;USD;ETF;US;EDGEA;Desenvolvido;1
GCAD;GABELLI COMMERCIAL AEROSPACE;GCAD;USD;ETF;US;IEX;Desenvolvido;1
GCAL;DYNAMIC CALIFORNIA MUNI ETF;GCAL;USD;ETF;US;BATS;Desenvolvido;1
GCC;WISDOMTREE ENHANCED COMMODIT;GCC;USD;ETF;US;MEMX;Desenvolvido;1
GCLN;GS BLOOMBERG CLEAN ENERGY;GCLN;USD;ETF;US;NYSENAT;Desenvolvido;1
GCOR;GOLDMAN SACHS ACCESS US AGG;GCOR;USD;ETF;US;LTSE;Desenvolvido;1
GCOW;PACER GLOBAL CASH COWS DIVID;GCOW;USD;ETF;US;IEX;Desenvolvido;1
GDE;WISDOMTREE EFFICIENT GOLD PL;GDE;USD;ETF;US;NYSENAT;Desenvolvido;1
GDEC;FT VEST US EQUITY MODERATE B;GDEC;USD;ETF;US;MEMX;Desenvolvido;1
GDIV;HARBOR DIVIDEND GROWTH LEADE;GDIV;USD;ETF;US;ARCA;Desenvolvido;1
GDMA;GADSDEN DYNAMIC MULTI-ASSET;GDMA;USD;ETF;US;MEMX;Desenvolvido;1
GDMN;WISDOMTREE EFF GOLD PL MINER;GDMN;USD;ETF;US;ARCA;Desenvolvido;1
GDOC;GOLDMAN SACHS FUTURE HEALTH;GDOC;USD;ETF;US;CHX;Desenvolvido;1
GDX;VANECK GOLD MINERS ETF;GDX;USD;ETF;US;MEMX;Desenvolvido;1
GDX;VANECK GOLD MINERS ETF;GDX;MXN;ETF;US;MEXI*;Desenvolvido;0
GDXD;MICROSECTORS GOLD MINERS -3X;GDXD;USD;ETF;US;DRCTEDGE;Desenvolvido;1
GDXJ;VANECK JUNIOR GOLD MINERS;GDXJ;USD;ETF;US;DRCTEDGE;Desenvolvido;1
GDXU;MICROSECTORS GOLD MINERS 3X;GDXU;USD;ETF;US;NYSE;Desenvolvido;1
GDXY;YLDMAX GOLD MIN OP IN ST ETF;GDXY;USD;ETF;US;MEMX;Desenvolvido;1
GEM;GOLDMAN SACHS ACTIVEBETA EM;GEM;USD;ETF;US;AMEX;Desenvolvido;1
GEM;GOLDMAN SACHS ACTIVEBETA EM;GEM;MXN;ETF;US;MEXI*;Desenvolvido;0
GEMD;GOLDMAN ACCESS EM USD BOND;GEMD;USD;ETF;US;PHLX;Desenvolvido;1
GENM;GENTER CAPITAL MUNICIPAL;GENM;USD;ETF;US;LTSE;Desenvolvido;1
GENT;GENTER CAPITAL TAXABLE;GENT;USD;ETF;US;LTSE;Desenvolvido;1
GEQ1;INVESCO NASDAQ NEXT GEN 100;GEQ1;EUR;ETF;US;GETTEX*;Desenvolvido;0
GFEB;FT VEST US EQUITY MODERATE B;GFEB;USD;ETF;US;BEX;Desenvolvido;1
GFGF;GURU FAVORITE STOCKS ETF;GFGF;USD;ETF;US;MEMX;Desenvolvido;1
GFLW;VS FREE CASH FLOW GROWTH ETF;GFLW;USD;ETF;US;BEX;Desenvolvido;1
GGLL;DIREXION DAILY GOOGL BULL 2X;GGLL;USD;ETF;US;ARCA;Desenvolvido;1
GGLS;DIREXION DAILY GOOGL BEAR 1X;GGLS;USD;ETF;US;AMEX;Desenvolvido;1
GGM;GGM MACRO ALIGNMENT ETF;GGM;USD;ETF;US;LTSE;Desenvolvido;1
GGME;INVESCO NEXT GEN MEDIA AND G;GGME;USD;ETF;US;CHX;Desenvolvido;1
GGRW;GABELLI GLOBAL GROWTH ETF;GGRW;USD;ETF;US;LTSE;Desenvolvido;1
GGUS;GOLDMAN SS MB RL 1000 GE ETF;GGUS;USD;ETF;US;ARCA*;Desenvolvido;1
GHMS;GOOSE HLW MULT STRAT INC ETF;GHMS;USD;ETF;US;AMEX;Desenvolvido;1
GHTA;GOOSE HOLLOW TACTICAL ALLOC;GHTA;USD;ETF;US;BYX;Desenvolvido;1
GHYB;GOLDMAN SACHS ACCESS HY CORP;GHYB;USD;ETF;US;MEMX;Desenvolvido;1
GHYG;ISHARES US&INTL HIGH YIELD C;GHYG;USD;ETF;US;AMEX;Desenvolvido;1
GIAX;NICHOLAS GLBL EQ INC ETF;GIAX;USD;ETF;US;BEX;Desenvolvido;1
GIGB;GOLDMAN SACHS INV GRD CORP;GIGB;USD;ETF;US;NYSENAT;Desenvolvido;1
GII;SPDR S&P GLOBAL INFRASTRUCTU;GII;USD;ETF;US;BATS;Desenvolvido;1
GINN;GOLDMAN SACHS INNOVATE EQTY;GINN;USD;ETF;US;LTSE;Desenvolvido;1
GINN;GOLDMAN SACHS INNOVATE EQTY;GINN;MXN;ETF;US;MEXI*;Desenvolvido;0
GINX;SGI ENH GL INC ETF;GINX;USD;ETF;US;DRCTEDGE;Desenvolvido;1
GJAN;FT VEST US EQUITY MODERATE B;GJAN;USD;ETF;US;EDGEA;Desenvolvido;1
GJUL;FT VEST US EQUITY MODERATE B;GJUL;USD;ETF;US;IEX;Desenvolvido;1
GJUN;FT VEST US EQUITY MODERATE B;GJUN;USD;ETF;US;EDGEA;Desenvolvido;1
GK;ADVISORSHARES GERBER KAWASAK;GK;USD;ETF;US;NYSE;Desenvolvido;1
GLBL;PACERMSCI WRLD IND ADV;GLBL;USD;ETF;US;BEX;Desenvolvido;1
GLD;SPDR GOLD SHARES;GLD;USD;ETF;US;LTSE;Desenvolvido;1
GLDI;UBS AG ET GL SHR COVR CL ETN;GLDI;USD;ETF;US;NASDAQ*;Desenvolvido;1
GLDM;SPDR GOLD MINISHARES TRUST;GLDM;USD;ETF;US;PHLX;Desenvolvido;1
GLDM;SPDR GOLD MINISHARES TRUST;GLDM;MXN;ETF;US;MEXI*;Desenvolvido;0
GLIN;VANECK INDIA GROWTH LEADERS;GLIN;USD;ETF;US;BEX;Desenvolvido;1
GLL;PROSHARES ULTRASHORT GOLD;GLL;USD;ETF;US;IEX;Desenvolvido;1
GLOF;ISHARES GLOBAL EQUITY FACTOR;GLOF;USD;ETF;US;BEX;Desenvolvido;1
GLOV;GS ACTIVE BETA WORLD LVOL PL;GLOV;USD;ETF;US;DRCTEDGE;Desenvolvido;1
GLOW;VS WESTEND GLOBAL EQUITY ETF;GLOW;USD;ETF;US;CHX;Desenvolvido;1
GLRY;INSPIRE MOMENTUM ETF;GLRY;USD;ETF;US;PEARL;Desenvolvido;1
GLTR;ABRDN PHYSICAL PRECIOUS MET;GLTR;USD;ETF;US;MEMX;Desenvolvido;1
GMAR;FT VEST US EQUITY MODERATE B;GMAR;USD;ETF;US;IEX;Desenvolvido;1
GMAY;FT VEST U.S. EQUITY MODERATE;GMAY;USD;ETF;US;IEX;Desenvolvido;1
GMET;VANECK GREEN METALS;GMET;USD;ETF;US;CHX;Desenvolvido;1
GMF;SPDR S&P EMERGING ASIA PACIF;GMF;USD;ETF;US;ARCA*;Desenvolvido;1
GMMA;GAMMAROAD MKT NAVIGATION ETF;GMMA;USD;ETF;US;EDGEA;Desenvolvido;1
GMNY;DYNAMIC NY MUNI INCOME;GMNY;USD;ETF;US;AMEX;Desenvolvido;1
GMOI;GMO INTERNATIONAL VALUE ETF;GMOI;USD;ETF;US;IEX;Desenvolvido;1
GMOM;CAMBRIA GLOBAL MOMENTUM ETF;GMOM;USD;ETF;US;BEX;Desenvolvido;1
GMOV;GMO U.S. VALUE ETF;GMOV;USD;ETF;US;MEMX;Desenvolvido;1
GMUB;GS MUNICIPAL INCOME ETF;GMUB;USD;ETF;US;LTSE;Desenvolvido;1
GMUN;GS COMMUNITY MUNI BOND ETF;GMUN;USD;ETF;US;LTSE;Desenvolvido;1
GNMA;ISHARES GNMA BOND ETF;GNMA;USD;ETF;US;AMEX;Desenvolvido;1
GNOM;GLOBAL X GENOMICS & BIOTECHN;GNOM;USD;ETF;US;NYSENAT;Desenvolvido;1
GNOM;GLOBAL X GENOMICS & BIOTECHN;GNOM;MXN;ETF;US;MEXI*;Desenvolvido;0
GNOV;FT VEST US EQUITY MODERATE B;GNOV;USD;ETF;US;PSX;Desenvolvido;1
GNR;SPDR S&P GL NAT RESOURCES;GNR;USD;ETF;US;BEX;Desenvolvido;1
GNR;SPDR S&P GL NAT RESOURCES;GNR;MXN;ETF;US;MEXI*;Desenvolvido;0
GOAU;US GLB GLD & METAL MNRS ETF;GOAU;USD;ETF;US;AMEX;Desenvolvido;1
GOAU;US GLB GLD & METAL MNRS ETF;GOAU;MXN;ETF;US;MEXI*;Desenvolvido;0
GOCT;FT VEST US EQUITY MODERATE B;GOCT;USD;ETF;US;PHLX;Desenvolvido;1
GOEX;GLOBAL X GOLD EXPLORERS ETF;GOEX;USD;ETF;US;LTSE;Desenvolvido;1
GOEX;GLOBAL X GOLD EXPLORERS ETF;GOEX;MXN;ETF;US;MEXI*;Desenvolvido;0
GOLY;STRATEGY SHARES GOLD ENHANCED;GOLY;USD;ETF;US;MEMX;Desenvolvido;1
GOOP;KURV YLD PREM STR GOOGL ETF;GOOP;USD;ETF;US;AMEX;Desenvolvido;1
GOOX;T-REX 2X LNG ALPHABET DLY;GOOX;USD;ETF;US;BYX;Desenvolvido;1
GOOY;YIELDMAX GOOGL OPTION INCOME;GOOY;USD;ETF;US;DRCTEDGE;Desenvolvido;1
GOVI;INVESCO EQUAL WEIGHT 0-30 YR;GOVI;USD;ETF;US;AMEX;Desenvolvido;1
GOVT;ISHARES US TREASURY BOND ETF;GOVT;USD;ETF;US;AMEX;Desenvolvido;1
GOVT;ISHARES US TREASURY BOND ETF;GOVT;MXN;ETF;US;MEXI*;Desenvolvido;0
GOVZ;ISHARES 25+ YR TREAS STRIPS;GOVZ;USD;ETF;US;BYX;Desenvolvido;1
GPIQ;NASDAQ 100 CORE PREM INC ETF;GPIQ;USD;ETF;US;EDGEA;Desenvolvido;1
GPIX;S&P 500 CORE PREMIUM INCOME;GPIX;USD;ETF;US;LTSE;Desenvolvido;1
GPOW;GS NRTH AMER PIPELNE AND POW;GPOW;USD;ETF;US;OVERNIGHT;Desenvolvido;1
GPRF;ACCESS PREFERRED AND HYBRID;GPRF;USD;ETF;US;NASDAQ*;Desenvolvido;1
GQ9;SPDR GOLD SHARES;GQ9;EUR;ETF;US;GETTEX;Desenvolvido;0
GQI;NATIXIS GATEWAY QUALITY INC;GQI;USD;ETF;US;ISLAND;Desenvolvido;1
GQQQ;ASTORIA US QLITY GRW KNG ETF;GQQQ;USD;ETF;US;LTSE;Desenvolvido;1
GQRE;FLEXSHARES GLOBAL QUALITY RE;GQRE;USD;ETF;US;ISLAND;Desenvolvido;1
GREI;GOLDMAN SACHS FUT REAL ESTAT;GREI;USD;ETF;US;ISE;Desenvolvido;1
GREK;GLOBAL X MSCI GREECE ETF;GREK;USD;ETF;US;PSX;Desenvolvido;1
GREK;GLOBAL X MSCI GREECE ETF;GREK;MXN;ETF;US;MEXI*;Desenvolvido;0
GRID;FIRST TRST NASD CL EDG SGIIF;GRID;USD;ETF;US;ARCA;Desenvolvido;1
GRID;FIRST TRST NASD CL EDG SGIIF;GRID;MXN;ETF;US;MEXI*;Desenvolvido;0
GRN;IPATH SERIES B CARBON ETN;GRN;USD;ETF;US;ARCA*;Desenvolvido;1
GRNB;VANECK GREEN BOND ETF;GRNB;USD;ETF;US;ARCA*;Desenvolvido;1
GRNY;FNDSTRT GRNNY SHOTS US LRG;GRNY;USD;ETF;US;BEX;Desenvolvido;1
GROZ;ZACKS FOCUS GROWTH ETF;GROZ;USD;ETF;US;LTSE;Desenvolvido;1
GRPM;INVESCO S&P MIDCAP 400 GARP;GRPM;USD;ETF;US;MEMX;Desenvolvido;1
GRPZ;INVESCO S&P SC 600 GARP ETF;GRPZ;USD;ETF;US;DRCTEDGE;Desenvolvido;1
GRW;TCW COMPOUNDERS ETF;GRW;USD;ETF;US;ISLAND;Desenvolvido;1
GSC;SMALL CAP CORE EQUITY ETF;GSC;USD;ETF;US;MEMX;Desenvolvido;1
GSCE;GS CONNECT S&P GSCI ENH COMM;GSCE;USD;ETF;US;OTCLNKECN;Desenvolvido;1
GSD;SPDR GOLD SHARES;GSD;SGD;ETF;US;SGX*;Desenvolvido;0
GSEE;GOLDMAN SACHS MARKETBETA EME;GSEE;USD;ETF;US;MEMX;Desenvolvido;1
GSEP;FT VEST US EQUITY MODERATE B;GSEP;USD;ETF;US;EDGEA;Desenvolvido;1
GSEU;GOLDMAN ACTIVEBTA EUR EQ ETF;GSEU;USD;ETF;US;EDGEA;Desenvolvido;1
GSEW;GOLDMAN SACHS EQL WGHT LARGE;GSEW;USD;ETF;US;NYSE;Desenvolvido;1
GSFP;GS FUTURE PLANET EQUITY ETF;GSFP;USD;ETF;US;AMEX;Desenvolvido;1
GSG;ISHARES S&P GSCI COMMODITY I;GSG;USD;ETF;US;MEMX;Desenvolvido;1
GSIB;THEMES GLBL SYST IMPRT BNKS;GSIB;USD;ETF;US;NASDAQ*;Desenvolvido;1
GSID;GOLDMAN SACHS MARKETBETA INT;GSID;USD;ETF;US;AMEX;Desenvolvido;1
GSIE;GOLDMAN SACHS ACTIVEBETA INT;GSIE;USD;ETF;US;EDGEA;Desenvolvido;1
GSIE;GOLDMAN SACHS ACTIVEBETA INT;GSIE;MXN;ETF;US;MEXI*;Desenvolvido;0
GSIG;GOLDMAN SACHS ACCESS INVESTM;GSIG;USD;ETF;US;IEX;Desenvolvido;1
GSJY;GOLDMAN ACTIVEBETA JP EQ ETF;GSJY;USD;ETF;US;LTSE;Desenvolvido;1
GSKH;GSK PLC ADRHEDGED;GSKH;USD;ETF;US;BATS*;Desenvolvido;1
GSLC;GOLDMAN ACTIVEBETA US LC ETF;GSLC;USD;ETF;US;CHX;Desenvolvido;1
GSLC;GOLDMAN ACTIVEBETA US LC ETF;GSLC;MXN;ETF;US;MEXI*;Desenvolvido;0
GSPY;GOTHAM ENHANCED 500 ETF;GSPY;USD;ETF;US;AMEX;Desenvolvido;1
GSSC;GOLDMAN SACHS ACTIVEBETA US;GSSC;USD;ETF;US;CHX;Desenvolvido;1
GSST;GOLDMAN SACHS ACCESS U/SHORT;GSST;USD;ETF;US;OVERNIGHT;Desenvolvido;1
GSUS;GOLDMAN SACHS MARKETBETA US;GSUS;USD;ETF;US;NYSE;Desenvolvido;1
GSY;INVESCO ULTRA SHORT DURATION;GSY;USD;ETF;US;NYSENAT;Desenvolvido;1
GTEK;GS FUTURE TECH LEADERS EQ;GTEK;USD;ETF;US;DRCTEDGE;Desenvolvido;1
GTIP;GOLDMAN SACHS ACCESS INFLATI;GTIP;USD;ETF;US;AMEX;Desenvolvido;1
GTO;INVESCO TOTAL RETURN BOND ET;GTO;USD;ETF;US;AMEX;Desenvolvido;1
GTR;WISDOMTREE TARGET RANGE FUND;GTR;USD;ETF;US;ARCA;Desenvolvido;1
GUMI;ULTRA SHORT MUNICIPAL INCOME;GUMI;USD;ETF;US;PHLX;Desenvolvido;1
GUNR;FLEXSHARES GLOBAL UPSTREAM N;GUNR;USD;ETF;US;IEX;Desenvolvido;1
GUNZ;TUTTLE CAPITAL SEF DF IN ETF;GUNZ;USD;ETF;US;NYSE;Desenvolvido;1
GURU;GLOBAL X GURU INDEX ETF;GURU;USD;ETF;US;NYSE;Desenvolvido;1
GUSA;GOLDMAN SACHS MARKETBETA US;GUSA;USD;ETF;US;BEX;Desenvolvido;1
GUSH;DIREXION DAILY S&P OIL & GAS;GUSH;USD;ETF;US;MEMX;Desenvolvido;1
GUSH;DIREXION DAILY S&P OIL & GAS;GUSH;MXN;ETF;US;MEXI*;Desenvolvido;0
GVAL;CAMBRIA GLOBAL VALUE ETF;GVAL;USD;ETF;US;NYSENAT;Desenvolvido;1
GVI;ISHARES INTERMEDIATE GOVERNM;GVI;USD;ETF;US;AMEX;Desenvolvido;1
GVIP;GOLD SACHS HEDGE IND VIP ETF;GVIP;USD;ETF;US;AMEX;Desenvolvido;1
GVLU;GOTHAM 1000 VALUE ETF;GVLU;USD;ETF;US;IEX;Desenvolvido;1
GVUS;GOLDMAN SACHS MB R1000 VAL;GVUS;USD;ETF;US;PSX;Desenvolvido;1
GWX;SPDR S&P INTL SMALL CAP;GWX;USD;ETF;US;IEX;Desenvolvido;1
GXC;SPDR S&P CHINA ETF;GXC;USD;ETF;US;DRCTEDGE;Desenvolvido;1
GXG;GLOBAL X MSCI COLOMBIA ETF;GXG;USD;ETF;US;BEX;Desenvolvido;1
GXTG;GLOBAL X THEMATIC GROWTH ETF;GXTG;USD;ETF;US;IEX;Desenvolvido;1
GXTG;GLOBAL X THEMATIC GROWTH ETF;GXTG;MXN;ETF;US;MEXI*;Desenvolvido;0
GXUS;GOLDMAN SACHS MB TOT INT ETF;GXUS;USD;ETF;US;BATS;Desenvolvido;1
GYLD;ARROW DOW JONES GLOBAL YIELD;GYLD;USD;ETF;US;BEX;Desenvolvido;1
HACK;AMPLIFY CYBERSECURITY ETF;HACK;USD;ETF;US;EDGX;Desenvolvido;1
HACKUS;AMPLIFY CYBERSECURITY ETF;HACKUS;MXN;ETF;US;MEXI*;Desenvolvido;0
HAIL;SPDR S&P KENSHO SMART MOBILI;HAIL;USD;ETF;US;EDGEA;Desenvolvido;1
HAIL;SPDR S&P KENSHO SMART MOBILI;HAIL;MXN;ETF;US;MEXI*;Desenvolvido;0
HAO;INVESCO CHINA SMALL CAP ETF;HAO;MXN;ETF;US;MEXI*;Desenvolvido;0
HAP;VANECK NATURAL RESOURCES ETF;HAP;USD;ETF;US;LTSE;Desenvolvido;1
HAPI;HARBOR HUMAN CAPITAL FACTOR;HAPI;USD;ETF;US;CHX;Desenvolvido;1
HAPR;INNOVATOR PI 9 BUF ETF - APR;HAPR;USD;ETF;US;DRCTEDGE;Desenvolvido;1
HAPS;HARBOR HUMAN CAPITAL FACTOR;HAPS;USD;ETF;US;NYSENAT;Desenvolvido;1
HAPY;HARBOR HUMAN CAPITAL FACTOR;HAPY;USD;ETF;US;PSX;Desenvolvido;1
HAPY;HARBOR HUMAN CAPITAL FACTOR;HAPY;MXN;ETF;US;MEXI*;Desenvolvido;0
HARD;SIMPLIFY COMMODITIES STR K-1;HARD;USD;ETF;US;LTSE;Desenvolvido;1
HART;NYLI HEALTHY HEARTS ETF;HART;USD;ETF;US;BEX;Desenvolvido;1
HAUS;RESIDENTIAL REIT ETF;HAUS;USD;ETF;US;BEX;Desenvolvido;1
HAUZ;XTRACKERS INTL REAL ESTATE;HAUZ;USD;ETF;US;DRCTEDGE;Desenvolvido;1
HAWX;ISHARES CUR HDG MSCI ACWI-X;HAWX;USD;ETF;US;IBEOS;Desenvolvido;1
HBTC;FORTUNA HEDGED BITCOIN FUND;HBTC;USD;ETF;US;ARCA;Desenvolvido;1
HCMT;DIREXION HCM TACTIC US ETF;HCMT;USD;ETF;US;NYSENAT;Desenvolvido;1
HCOM;HARTFORD SCHRODERS COMMODITY;HCOM;USD;ETF;US;NYSENAT;Desenvolvido;1
HCOW;AMPLIFY CSH FL H/I ETF;HCOW;USD;ETF;US;NYSE;Desenvolvido;1
HCRB;HARTFORD CORE BOND ETF;HCRB;USD;ETF;US;DRCTEDGE;Desenvolvido;1
HDEF;XTRACKERS MSCI EAFE HIGH DIV;HDEF;USD;ETF;US;AMEX;Desenvolvido;1
HDG;PROSHARES HEDGE REPLICAT ETF;HDG;USD;ETF;US;NYSE;Desenvolvido;1
HDGE;ADVISORSHARES RANGER EQ BEAR;HDGE;USD;ETF;US;EDGEA;Desenvolvido;1
HDLB;ETRACS 2X HI DIV L-VOL ETN-B;HDLB;USD;ETF;US;NYSE;Desenvolvido;1
HDMV;FT HORIZON MGD VOL D INT ETF;HDMV;USD;ETF;US;ARCA*;Desenvolvido;1
HDRO;DEFIANCE NEXT GEN H2 ETF;HDRO;USD;ETF;US;DRCTEDGE;Desenvolvido;1
HDUS;HARTFORD DISCIP EQTY ETF;HDUS;USD;ETF;US;CHX;Desenvolvido;1
HDV;ISHARES CORE HIGH DIVIDEND E;HDV;USD;ETF;US;IEX;Desenvolvido;1
HDV;ISHARES CORE HIGH DIVIDEND E;HDV;MXN;ETF;US;MEXI*;Desenvolvido;0
HEAT;TOUCHSTONE CLMT TRANSETF;HEAT;USD;ETF;US;BYX;Desenvolvido;1
HECO;SPDR GALAXY HDAE ETF;HECO;USD;ETF;US;EDGEA;Desenvolvido;1
HEDJ;WISDOMTREE EUROPE HEDGED EQU;HEDJ;USD;ETF;US;EDGEA;Desenvolvido;1
HEEM;ISHARES CRNCY HEDGD MSCI EM;HEEM;USD;ETF;US;BEX;Desenvolvido;1
HEEM;ISHARES CRNCY HEDGD MSCI EM;HEEM;MXN;ETF;US;MEXI*;Desenvolvido;0
HEFA;ISHA CURR HEDGED MSCI EAFE;HEFA;USD;ETF;US;BATS*;Desenvolvido;1
HEFA;ISHA CURR HEDGED MSCI EAFE;HEFA;MXN;ETF;US;MEXI*;Desenvolvido;0
HEGD;SWAN HEDGED EQUITY US LG CAP;HEGD;USD;ETF;US;MEMX;Desenvolvido;1
HEJD;VS HEDGED EQUITY INCOME ETF;HEJD;USD;ETF;US;OVERNIGHT;Desenvolvido;1
HELO;JPMORGAN HEDGED EQUITY ETF;HELO;USD;ETF;US;IEX;Desenvolvido;1
HELX;FRANKLIN GENOMIC ADVANCEMENT;HELX;USD;ETF;US;MEMX;Desenvolvido;1
HEQT;SIMPLIFY HEDGED EQUITY ETF;HEQT;USD;ETF;US;DRCTEDGE;Desenvolvido;1
HERD;PACER CASH COWS FUND OF FUND;HERD;USD;ETF;US;IEX;Desenvolvido;1
HERO;GLOBAL X VIDEO GAMES& ESPORT;HERO;USD;ETF;US;IEX;Desenvolvido;1
HERO;GLOBAL X VIDEO GAMES& ESPORT;HERO;MXN;ETF;US;MEXI*;Desenvolvido;0
HEWJ;ISHA CURR HEDGED MSCI JAPAN;HEWJ;USD;ETF;US;AMEX;Desenvolvido;1
HEWJ;ISHA CURR HEDGED MSCI JAPAN;HEWJ;MXN;ETF;US;MEXI*;Desenvolvido;0
HEZU;ISHARES CURRENCY HEDGED MSCI;HEZU;USD;ETF;US;DRCTEDGE;Desenvolvido;1
HEZU;ISHARES CURRENCY HEDGED MSCI;HEZU;MXN;ETF;US;MEXI*;Desenvolvido;0
HF;DGA CORE PLUS ABS RTRN ETF;HF;USD;ETF;US;IEX;Desenvolvido;1
HFGO;HARTFORD LRG CAP GRWTH ETF;HFGO;USD;ETF;US;PHLX;Desenvolvido;1
HFND;UNLTD HFND MULT ST RET TRACK;HFND;USD;ETF;US;IBEOS;Desenvolvido;1
HFSP;TRADERSAI LARGE CAP EQTY ETF;HFSP;USD;ETF;US;BEX;Desenvolvido;1
HFXI;NYLI FTSE INT EQ CUR NEU-USD;HFXI;USD;ETF;US;AMEX;Desenvolvido;1
HGER;HARBOR COMMODITY ALL WEATHER;HGER;USD;ETF;US;IEX;Desenvolvido;1
HGER;HARBOR COMMODITY ALL WEATHER;HGER;MXN;ETF;US;MEXI*;Desenvolvido;0
HIBL;DIREXION DAILY S&P 500 HIGH;HIBL;USD;ETF;US;PSX;Desenvolvido;1
HIBS;DIREXION DAILY S&P 500 HIGH;HIBS;USD;ETF;US;NYSENAT;Desenvolvido;1
HIDE;ALPHA ARC HIGH INF & DEF ETF;HIDE;USD;ETF;US;IEX;Desenvolvido;1
HIDV;AB US HIGH DIVIDEND ETF;HIDV;USD;ETF;US;EDGEA;Desenvolvido;1
HIGH;SIMPLIFY ENHANCED INCOME ETF;HIGH;USD;ETF;US;EDGEA;Desenvolvido;1
HIPS;GRANITESHARES HIPS US HIGH I;HIPS;USD;ETF;US;LTSE;Desenvolvido;1
HISF;FIRST TR HI INC STRAT FOC;HISF;USD;ETF;US;LTSE;Desenvolvido;1
HIYS;INVESCO HIGH YIELD SLCT ETF;HIYS;USD;ETF;US;BYX;Desenvolvido;1
HJUL;INNOV PREM INC 9 BUF - JULY;HJUL;USD;ETF;US;PHLX;Desenvolvido;1
HKND;HUMANKIND US STOCK ETF;HKND;USD;ETF;US;BEX;Desenvolvido;1
HLAL;WAHED FTSE USA SHARIAH ETF;HLAL;USD;ETF;US;IEX;Desenvolvido;1
HLGE;HARTFORD LONGEVITY ECONOMY;HLGE;USD;ETF;US;EDGEA;Desenvolvido;1
HMOP;HARTFORD MUNICIPAL OPP ETF;HMOP;USD;ETF;US;IEX;Desenvolvido;1
HNDL;NASDAQ 7 HANDL INDEX ETF;HNDL;USD;ETF;US;EDGEA;Desenvolvido;1
HOCT;INNOV PRM INC 9BUFF ETF OCT;HOCT;USD;ETF;US;EDGEA;Desenvolvido;1
HODL;VANECK BITCOIN ETF-USD INC;HODL;USD;ETF;US;NYSENAT;Desenvolvido;1
HOMZ;HOYA CAPITAL HOUSING ETF;HOMZ;USD;ETF;US;PHLX;Desenvolvido;1
HQGO;HARTFORD US QULTY GRWTH ETF;HQGO;USD;ETF;US;ARCA;Desenvolvido;1
HRENW;HARBOR ENERGY TRANSITION ST;HRENW;MXN;ETF;US;MEXI*;Desenvolvido;0
HRTS;TEMA GLP-1 OBESITY & CARDIOM;HRTS;USD;ETF;US;AMEX;Desenvolvido;1
HSBH;HSBC HOLDINGS PLC ADRHEDGED;HSBH;USD;ETF;US;NYSE;Desenvolvido;1
HSCZ;ISHARES CUR HDG MSCI EAFE SM;HSCZ;USD;ETF;US;DRCTEDGE;Desenvolvido;1
HSMV;FIRST TRUST HORIZON MANAGED;HSMV;USD;ETF;US;OVERNIGHT;Desenvolvido;1
HSRT;HARTFORD AAA CLO ETF;HSRT;USD;ETF;US;AMEX;Desenvolvido;1
HSUN;HARTFOR STRATEG INCOME ETF-U;HSUN;USD;ETF;US;AMEX;Desenvolvido;1
HTAB;HARTFORD SCHRODERS TAX AWARE;HTAB;USD;ETF;US;EDGEA;Desenvolvido;1
HTEC;ROBO GLOBAL HEALTHCARE TECH;HTEC;USD;ETF;US;DRCTEDGE;Desenvolvido;1
HTRB;HARTFORD TTL RTRN BND ETF;HTRB;USD;ETF;US;BEX;Desenvolvido;1
HTUS;HULL TACTICAL US ETF;HTUS;USD;ETF;US;ARCA*;Desenvolvido;1
HUSV;FT HORIZON MNGD VOL DOM ETF;HUSV;USD;ETF;US;DRCTEDGE;Desenvolvido;1
HWAY;THEMES US INFRASTRUCTURE ETF;HWAY;USD;ETF;US;AMEX;Desenvolvido;1
HYBB;ISHARES BB RATED CORP BOND;HYBB;USD;ETF;US;ARCA*;Desenvolvido;1
HYBI;NEOS ENHANCED ICS ETF;HYBI;USD;ETF;US;AMEX;Desenvolvido;1
HYBI.OLD;NEOS ENHANCED ICS ETF;HYBI.OLD;OLD;ETF;US;IBEOS;Desenvolvido;0
HYBL;SPDR BLACKSTONE HIGH INCOME;HYBL;USD;ETF;US;AMEX;Desenvolvido;1
HYBX;TCW HIGH YIELD BOND ETF;HYBX;USD;ETF;US;EDGEA;Desenvolvido;1
HYD;VANECK HIGH YIELD MUNI ETF;HYD;USD;ETF;US;AMEX;Desenvolvido;1
HYDB;ISHARES HIGH YIELD SYSTEMATI;HYDB;USD;ETF;US;PSX;Desenvolvido;1
HYDB;ISHARES HIGH YIELD SYSTEMATI;HYDB;MXN;ETF;US;MEXI*;Desenvolvido;0
HYDR;GLOBAL X HYDROGEN ETF;HYDR;MXN;ETF;US;MEXI*;Desenvolvido;0
HYDR;GLOBAL X HYDROGEN ETF;HYDR;USD;ETF;US;NYSE;Desenvolvido;1
HYDW;XTRS LOW BETA HI YIELD ETF;HYDW;USD;ETF;US;ISE;Desenvolvido;1
HYEM;VANECK EMRG MKTS HI YLD;HYEM;MXN;ETF;US;MEXI*;Desenvolvido;0
HYEM;VANECK EMRG MKTS HI YLD;HYEM;USD;ETF;US;NYSENAT;Desenvolvido;1
HYFI;AB HIGH YIELD ETF;HYFI;USD;ETF;US;BATS;Desenvolvido;1
HYG;ISHARES IBOXX HIGH YLD CORP;HYG;USD;ETF;US;ARCA*;Desenvolvido;1
HYG;ISHARES IBOXX HIGH YLD CORP;HYG;MXN;ETF;US;MEXI*;Desenvolvido;0
HYGH;ISHARES INT RATE HEDG HY ETF;HYGH;USD;ETF;US;BEX;Desenvolvido;1
HYGI;ISHARES INFLATION HEDGED HIG;HYGI;USD;ETF;US;BYX;Desenvolvido;1
HYGV;FLEXSHARES HIGH YIELD VALUE;HYGV;USD;ETF;US;ISE;Desenvolvido;1
HYGW;ISHARES HY CORP BD BUYWR ETF;HYGW;USD;ETF;US;AMEX;Desenvolvido;1
HYGW;ISHARES HY CORP BD BUYWR ETF;HYGW;MXN;ETF;US;MEXI*;Desenvolvido;0
HYHG;PROSHARES HIGH YIELD INTERES;HYHG;USD;ETF;US;MEMX;Desenvolvido;1
HYIN;WISDOMTREE ALTERNATIVE INCOM;HYIN;USD;ETF;US;BEX;Desenvolvido;1
HYKE;VEST 2 YR INT RATE HDGE ETF;HYKE;USD;ETF;US;NYSE;Desenvolvido;1
HYLB;XTRACKERS USD HIGH YIELD COR;HYLB;USD;ETF;US;BEX;Desenvolvido;1
HYLB;XTRACKERS USD HIGH YIELD COR;HYLB;MXN;ETF;US;MEXI*;Desenvolvido;0
HYLG;GLOBAL X HLTH CARE COV CALL;HYLG;USD;ETF;US;IEX;Desenvolvido;1
