SYMBOL;DESCRIPTION;IBKR SYMBOL;CURRENCY;PRODUCT;REGION;EXCHANGE *PRIMARY EXCHANGE;Classificação Econômica;inloco
ZHDG;ZEGA BUY AND HEDGE ETF;ZHDG;USD;ETF;US;BEX;Desenvolvido;1
ZIG;THE ACQUIRERS FUND ETF;ZIG;USD;ETF;US;AMEX;Desenvolvido;1
ZJAN;INNOVATOR EDP ETF - 1Y JAN;ZJAN;USD;ETF;US;DRCTEDGE;Desenvolvido;1
ZJUL;INNOVATOR EDP ETF 1 YR JULY;ZJUL;USD;ETF;US;IEX;Desenvolvido;1
ZNOV;INVTR EQU DE PR ETF - 1 YR N;ZNOV;USD;ETF;US;BYX;Desenvolvido;1
ZOCT;INR EQTY DEF P ETF - 1 Y OC;ZOCT;USD;ETF;US;EDGEA;Desenvolvido;1
ZROZ;PIMCO 25+ YR ZERO CPN US TIF;ZROZ;USD;ETF;US;LTSE;Desenvolvido;1
ZSB;USCF SUST BATTERY METAL FUND;ZSB;USD;ETF;US;BATS;Desenvolvido;1
ZSC;USCF SUST COMMODITY STRATEGY;ZSC;USD;ETF;US;ARCA*;Desenvolvido;1
ZSEP;INNOVATOR EDP ETF - 1 YR SEP;ZSEP;USD;ETF;US;IEX;Desenvolvido;1
ZSL;PROSHARES ULTRASHORT SILVER;ZSL;USD;ETF;US;MEMX;Desenvolvido;1
ZTAX;X-SQUARE MUNICIPAL INCOME ET;ZTAX;USD;ETF;US;IBEOS;Desenvolvido;1
ZTEN;F/M 10-YEAR INV G CORP B ETF;ZTEN;USD;ETF;US;CHX;Desenvolvido;1
ZTRE;F/M 3-YEAR INV GR CORP B ETF;ZTRE;USD;ETF;US;DRCTEDGE;Desenvolvido;1
ZTWO;F/M 2-YEAR INV G CORP B ETF;ZTWO;USD;ETF;US;DRCTEDGE;Desenvolvido;1
ZVOL;VOLATILITY PRM PL ETF-INVUSD;ZVOL;USD;ETF;US;AMEX;Desenvolvido;1
ZZZ;CYBER HORNET S&P 500 & BITCO;ZZZ;USD;ETF;US;BEX;Desenvolvido;1
2446766D;VALOUR HEDERA;2446766D;EUR;ETF;KY;FWB*;Em Desenvolvimento;0
2452364D;VALOUR BITCOIN STAKING;2452364D;EUR;ETF;KY;FWB*;Em Desenvolvimento;0
ACAA;ARROW LONG/SHORT ALT FUND;ACAA;CAD;ETF;CA;TSE*;Desenvolvido;1
ADAVE;VALOUR CARDANO;ADAVE;EUR;ETF;KY;SBF*;Em Desenvolvimento;0
ADIV;ARRW EC EQTY ADGE ALT FUND;ADIV;CAD;ETF;CA;TSE*;Desenvolvido;1
AEMX;AGF EM MKTS EX CHINA FUND;AEMX;CAD;ETF;CA;AEQLIT*;Desenvolvido;1
AENU;AGF ENHANCED US EQTY INC FD;AENU;CAD;ETF;CA;AEQLIT*;Desenvolvido;1
AGG;EVOLVE CDN AGG BND ENH YLD;AGG;CAD;ETF;CA;AEQLIT;Desenvolvido;1
AGLR;AGF GLOBAL REAL ASSETS FUND;AGLR;CAD;ETF;CA;AEQLIT*;Desenvolvido;1
AGSG;AGF GLOBAL SUSTAINABLE GROW;AGSG;CAD;ETF;CA;AEQLIT*;Desenvolvido;1
AIGO;GLOBAL X AIT INDEX ETF;AIGO;CAD;ETF;CA;AEQLIT;Desenvolvido;1
AMAX;HAMILTON GOLD PRODUCER YLD;AMAX;CAD;ETF;CA;TSE*;Desenvolvido;1
AMHE;AMAZON ENHANCED HIGH INCOME;AMHE;CAD;ETF;CA;TSE*;Desenvolvido;1
AMHE.U;AMAZON ENHANCED HIGH INCOME;AMHE.U;USD;ETF;CA;TSE*;Desenvolvido;0
AMINAXUSD;AMINA CRYPTO ASS SEL IND ETP;AMINAXUSD;USD;ETF;KY;EBS*;Em Desenvolvimento;0
AMZH;AMAZON HIGH INCOME SHARES;AMZH;CAD;ETF;CA;TSE*;Desenvolvido;1
AMZH.U;AMAZON HIGH INCOME SHARES;AMZH.U;USD;ETF;CA;AEQLIT;Desenvolvido;0
ANGELD10;ANGELD 10;ANGELD10;MXN;ETF;MX;MEXI*;Em Desenvolvimento;1
APLY;APPLE YLD SHARES PURPOSE;APLY;CAD;ETF;CA;AEQLIT*;Desenvolvido;1
ARB;ACCELERATE ARBITRAGE FUND;ARB;CAD;ETF;CA;TSE*;Desenvolvido;1
ARKG;BMO ARK GENOMIC REV FUND ETF;ARKG;CAD;ETF;CA;AEQLIT*;Desenvolvido;1
ARKK;BMO ARK INNOVATION FUND ETF;ARKK;CAD;ETF;CA;AEQLIT*;Desenvolvido;1
ARKW;BMO ARK NXT GEN INTRNT ETF;ARKW;CAD;ETF;CA;AEQLIT*;Desenvolvido;1
ARTI;EVOLVE AI FUND;ARTI;CAD;ETF;CA;TSE*;Desenvolvido;1
ASMD;AGF US SM-MID CAP ETF;ASMD;CAD;ETF;CA;AEQLIT*;Desenvolvido;1
ATRB;AGF TOT RET BOND FUND ETF;ATRB;CAD;ETF;CA;AEQLIT*;Desenvolvido;1
ATSX;ACCELERATE CANADIAN L SH EF;ATSX;CAD;ETF;CA;TSE*;Desenvolvido;1
AUGB.F;FT VT US EQ BF ETF-AUG;AUGB.F;CAD;ETF;CA;TSE*;Desenvolvido;1
BANK;EVOL C BKN LC EN YLD IDX FD;BANK;CAD;ETF;CA;AEQLIT;Desenvolvido;1
BASE;EVOLVE GLOBAL MAT & MIN EN Y;BASE;CAD;ETF;CA;TSE*;Desenvolvido;1
BASE.B;EVOLVE GLOBAL MAT & MIN EN Y;BASE.B;CAD;ETF;CA;AEQLIT;Desenvolvido;1
BDIV;BROMPTON GLOBAL DIVIDEND-ETF;BDIV;CAD;ETF;CA;AEQLIT;Desenvolvido;1
BEPR;BROMPTON ENHANCED IG PREF;BEPR;CAD;ETF;CA;AEQLIT;Desenvolvido;1
BESG;INVESCO ESG CANADIAN CORE PL;BESG;CAD;ETF;CA;TSE*;Desenvolvido;1
BFIN;BROMPTON NORTH AMERICAN FINA;BFIN;CAD;ETF;CA;AEQLIT;Desenvolvido;1
BGC;BRISTOL GATE CONCENTRAT ETF;BGC;CAD;ETF;CA;TSE*;Desenvolvido;1
BGDV;BMO GLBL DVD OPPORTUNITIES;BGDV;CAD;ETF;CA;AEQLIT*;Desenvolvido;1
BGEQ;BMO GLOBAL EQUITY FUND;BGEQ;CAD;ETF;CA;AEQLIT*;Desenvolvido;1
BGHC;BMO GLOBAL HEALTH CARE FUND;BGHC;CAD;ETF;CA;AEQLIT*;Desenvolvido;1
BGIF;BMO GLBL INFRA FUND;BGIF;CAD;ETF;CA;AEQLIT*;Desenvolvido;1
BGIN;BMO GLOBAL INNOVATORS FUND;BGIN;CAD;ETF;CA;AEQLIT*;Desenvolvido;1
BGRT;BMO GLOBAL REIT FUND;BGRT;CAD;ETF;CA;AEQLIT*;Desenvolvido;1
BGU;BRISTOL GATE CONCEN US ETF;BGU;CAD;ETF;CA;TSE*;Desenvolvido;1
BGU.U;BRISTOL GATE CONCEN USD ETF;BGU.U;USD;ETF;CA;TSE*;Desenvolvido;0
BITI;BETAPRO INVERSE BITCOIN ETF;BITI;CAD;ETF;CA;AEQLIT;Desenvolvido;1
BKCC;GLO X EQU WGT CAND BNK COV C;BKCC;CAD;ETF;CA;AEQLIT;Desenvolvido;1
BKCL;GLB X ENH EQ CDN ETF-A CAD I;BKCL;CAD;ETF;CA;AEQLIT;Desenvolvido;1
BLCK;FT INDXX INNOVATIVE TRANS/CA;BLCK;CAD;ETF;CA;AEQLIT;Desenvolvido;1
BLOV;BROMPTON NORTH AMER LOW VOL;BLOV;CAD;ETF;CA;TSE*;Desenvolvido;1
BMAX;BROMPTON ENH MULTI-ASSET ETF;BMAX;CAD;ETF;CA;AEQLIT;Desenvolvido;1
BNC;PURPOSE CDN FIF ETF SHARES;BNC;CAD;ETF;CA;AEQLIT;Desenvolvido;1
BND;PURPOSE GLOBAL BOND FUND;BND;CAD;ETF;CA;AEQLIT;Desenvolvido;1
BNKL;GLOBAL X ENHANCED EQL-A CD I;BNKL;CAD;ETF;CA;AEQLIT;Desenvolvido;1
BOND;EVOLVE ENHANCED YLD BND FUND;BOND;CAD;ETF;CA;AEQLIT;Desenvolvido;1
BOND.B;EVOLVE ENHANCED YLD BND FUND;BOND.B;CAD;ETF;CA;TSE*;Desenvolvido;1
BPRF;BROMPTON FLAHERTY & CRUMI ET;BPRF;CAD;ETF;CA;TSE*;Desenvolvido;1
BREA;BROMPTON SUST RL ASST DVD;BREA;CAD;ETF;CA;TSE*;Desenvolvido;1
BRKY;BERKSHIRE HATHAWAY YLD SH PU;BRKY;CAD;ETF;CA;AEQLIT*;Desenvolvido;1
BSKT;MANULIFE SMART CORE BOND ETF;BSKT;CAD;ETF;CA;AEQLIT;Desenvolvido;1
BTC0E;VALOUR BITCOIN ZERO;BTC0E;EUR;ETF;KY;AEB*;Em Desenvolvimento;0
BTCC;PURPOSE BITCOIN ETF;BTCC;CAD;ETF;CA;AEQLIT;Desenvolvido;1
BTCC.B;PURPOSE BITCOIN ETF;BTCC.B;CAD;ETF;CA;TSE*;Desenvolvido;1
BTCC.J;PURPOSE BITCOIN ETF;BTCC.J;CAD;ETF;CA;TSE*;Desenvolvido;1
BTCC.U;PURPOSE BITCOIN ETF;BTCC.U;USD;ETF;CA;AEQLIT;Desenvolvido;0
BTCQ;3IQ BITCOIN ETF;BTCQ;CAD;ETF;CA;AEQLIT;Desenvolvido;1
BTCQ.U;3IQ BITCOIN ETF;BTCQ.U;USD;ETF;CA;TSE*;Desenvolvido;0
BTCX.B;CI GALAXY BITCOIN ETF;BTCX.B;CAD;ETF;CA;AEQLIT;Desenvolvido;1
BTCX.U;CI GALAXY BITCOIN ETF USD;BTCX.U;USD;ETF;CA;AEQLIT;Desenvolvido;0
BTCY;PURPOSE BITCOIN YIELD ETF;BTCY;CAD;ETF;CA;AEQLIT;Desenvolvido;1
BTCY.B;PURPOSE BITCOIN YIELD ETF;BTCY.B;CAD;ETF;CA;AEQLIT;Desenvolvido;1
BTCY.U;PURPOSE BITCOIN YIELD ETF-US;BTCY.U;USD;ETF;CA;AEQLIT;Desenvolvido;0
BUFR;FIRST TRUST VEST FUND OF BUF;BUFR;CAD;ETF;CA;AEQLIT*;Desenvolvido;1
BXF;CI 1-5 YEAR LADDERED GOVERN;BXF;CAD;ETF;CA;TSE*;Desenvolvido;1
CACB;CIBC ACTIVE INVESTMENT GRADE;CACB;CAD;ETF;CA;AEQLIT;Desenvolvido;1
CAFR;CIBC ACTIVE INVST GR BND ETF;CAFR;CAD;ETF;CA;AEQLIT;Desenvolvido;1
CAGG;CI CANADIAN AGG BD INDEX ETF;CAGG;CAD;ETF;CA;AEQLIT;Desenvolvido;1
CAGS;CI CN SH-TERM AG BD INDX ETF;CAGS;CAD;ETF;CA;TSE*;Desenvolvido;1
CALL;EVOLVE US BANKS ENHANCED YIE;CALL;CAD;ETF;CA;AEQLIT;Desenvolvido;1
CALL.B;EVOLVE US BANKS UNHEDGED;CALL.B;CAD;ETF;CA;TSE*;Desenvolvido;1
CALL.U;EVOLVE US BANKS ENHANCED YIE;CALL.U;USD;ETF;CA;AEQLIT;Desenvolvido;0
CANL;GLOB X ENH S&P/TSX 60 IN ETF;CANL;CAD;ETF;CA;TSE*;Desenvolvido;1
CAPG;CAP GROUP EQUITY SELECT ETF;CAPG;CAD;ETF;CA;AEQLIT;Desenvolvido;1
CAPI;CAP GROUP INTL EQUITY ETF;CAPI;CAD;ETF;CA;AEQLIT;Desenvolvido;1
CAPM;CAP GROUP MULTISECTOR ETF;CAPM;CAD;ETF;CA;AEQLIT;Desenvolvido;1
CAPW;CAP GROUP WORLD BOND ETF;CAPW;CAD;ETF;CA;TSE*;Desenvolvido;1
CARB;GLOBAL X CARBON CREDITS ETF;CARB;CAD;ETF;CA;AEQLIT;Desenvolvido;1
CARS;EVOLVE AUTOMOBILE INNOVATION;CARS;CAD;ETF;CA;AEQLIT;Desenvolvido;1
CARS.B;EVOLVE AUTO INNOVATION ETF;CARS.B;CAD;ETF;CA;TSE*;Desenvolvido;1
CASH;GLB X HIGH INTERST SVNGS ETF;CASH;CAD;ETF;CA;AEQLIT;Desenvolvido;1
CBAL;CI BAL ASSET ALLOC ETF;CBAL;CAD;ETF;CA;AEQLIT;Desenvolvido;1
CBCX;CI GALAXY BLOCKCHAIN INDEX E;CBCX;CAD;ETF;CA;AEQLIT;Desenvolvido;1
CBGR;CI BAL GRWTH ASSET ALLOC ETF;CBGR;CAD;ETF;CA;TSE*;Desenvolvido;1
CBH;ISHARES 1-10 YEAR LADDERED C;CBH;CAD;ETF;CA;TSE*;Desenvolvido;1
CBIL;GLOBAL X 0-3 MONTH T-BILL-A;CBIL;CAD;ETF;CA;AEQLIT;Desenvolvido;1
CBIN;CI BAL INC ASSET ALLOC ETF;CBIN;CAD;ETF;CA;TSE*;Desenvolvido;1
CBL;FRK CORE ETF PORTFOLIO;CBL;CAD;ETF;CA;TSE*;Desenvolvido;1
CBND;MANULIFE SMART CORPORATE BND;CBND;CAD;ETF;CA;AEQLIT;Desenvolvido;1
CBNK;MULVIHILL CANADIAN BANK ENHA;CBNK;CAD;ETF;CA;AEQLIT;Desenvolvido;1
CBO;ISHARES 1-5 YEAR LADDERED CO;CBO;CAD;ETF;CA;TSE*;Desenvolvido;1
CBON;NINEPOINT CARBON CREDIT ETF;CBON;CAD;ETF;CA;AEQLIT*;Desenvolvido;1
CBON.U;NINEPOINT CARBON CREDIT-U;CBON.U;USD;ETF;CA;AEQLIT*;Desenvolvido;0
CBUG;CI DIGITAL SECURITY INDEX ET;CBUG;CAD;ETF;CA;AEQLIT;Desenvolvido;1
CCBD;CI US AGG BD COVER CALL ETF;CCBD;CAD;ETF;CA;AEQLIT;Desenvolvido;1
CCBI;CIBC CANADIAN BOND INDEX ETF;CCBI;CAD;ETF;CA;AEQLIT;Desenvolvido;1
CCDN;CI CANADIAN EQUITY INDEX ETF;CCDN;CAD;ETF;CA;AEQLIT*;Desenvolvido;1
CCEI;CIBC CANADIAN EQUITY INDEX;CCEI;CAD;ETF;CA;AEQLIT;Desenvolvido;1
CCLN;CIBC CLEAN ENERGY ETF;CCLN;CAD;ETF;CA;AEQLIT*;Desenvolvido;1
CCNS;CIBC CONSERVATIVE FI POOL;CCNS;CAD;ETF;CA;AEQLIT;Desenvolvido;1
CCNV;CI CONSV ASSET ALLOC ETF;CCNV;CAD;ETF;CA;AEQLIT;Desenvolvido;1
CCOM;CI AUSPICE BROAD COMMODITY F;CCOM;CAD;ETF;CA;AEQLIT;Desenvolvido;1
CCRE;CIBC CORE FIXED INCOME ETF;CCRE;CAD;ETF;CA;AEQLIT;Desenvolvido;1
CDEF;MANULIFE SMART DEFENSIVE EQY;CDEF;CAD;ETF;CA;AEQLIT;Desenvolvido;1
CDIV;MANULIFE SMART DIVIDEND ETF;CDIV;CAD;ETF;CA;TSE*;Desenvolvido;1
CDLB;CI DL TOTAL RETURN BOND USD;CDLB;CAD;ETF;CA;TSE*;Desenvolvido;1
CDLB.B;CI DL TOTAL RETURN BOND US-B;CDLB.B;CAD;ETF;CA;AEQLIT;Desenvolvido;1
CDNA;CI BIO-REVOLUTION INDEX ETF;CDNA;CAD;ETF;CA;AEQLIT;Desenvolvido;1
CDZ;ISHARES S&P/TSX CANADIAN DIV;CDZ;CAD;ETF;CA;AEQLIT;Desenvolvido;1
CEMI;CIBC EMERGING MARKETS EQUITY;CEMI;CAD;ETF;CA;AEQLIT;Desenvolvido;1
CEQT;CI EQ ASSET ALLOC ETF;CEQT;CAD;ETF;CA;TSE*;Desenvolvido;1
CESG;CI MSCI WORLD ESG IMPACT IND;CESG;CAD;ETF;CA;AEQLIT*;Desenvolvido;1
CESG.B;CI MSCI WORLD ESG IMPT-B;CESG.B;CAD;ETF;CA;AEQLIT*;Desenvolvido;1
CEW;ISHARES EQUAL WEIGHT BANC &;CEW;CAD;ETF;CA;TSE*;Desenvolvido;1
CFLX;CIBC FLEXIBLE YIELD ETF-CAD;CFLX;CAD;ETF;CA;TSE*;Desenvolvido;1
CFRT;CI FLOATING RATE INCOME FUND;CFRT;CAD;ETF;CA;AEQLIT;Desenvolvido;1
CGAA;CI GLOBAL ASSET ALLOCATION P;CGAA;CAD;ETF;CA;AEQLIT;Desenvolvido;1
CGBI;CIBC GLOBAL BOND EX-CANADA I;CGBI;CAD;ETF;CA;AEQLIT;Desenvolvido;1
CGDV;CI GLOB MIN DOWNSIDE VOL-HED;CGDV;CAD;ETF;CA;AEQLIT;Desenvolvido;1
CGDV.B;CI GLOB MIN DOWNSIDE VOL-UNH;CGDV.B;CAD;ETF;CA;TSE*;Desenvolvido;1
CGHY;CI HIGH YIELD BOND PVT POOL;CGHY;CAD;ETF;CA;AEQLIT;Desenvolvido;1
CGIN;CI GLB INVSTMNT GRD ETF-CAD;CGIN;CAD;ETF;CA;AEQLIT;Desenvolvido;1
CGL;ISHARES GOLD BULLION ETF;CGL;CAD;ETF;CA;TSE*;Desenvolvido;1
CGL.C;ISHARES GOLD BULLION FUND;CGL.C;CAD;ETF;CA;TSE*;Desenvolvido;1
CGLO;CIBC GLOBAL GROWTH ETF;CGLO;CAD;ETF;CA;AEQLIT;Desenvolvido;1
CGQD.B;CI GL QUTY DIV GRWTH ETF;CGQD.B;CAD;ETF;CA;AEQLIT;Desenvolvido;1
CGR;ISHARES GLOBAL REAL ESTATE I;CGR;CAD;ETF;CA;AEQLIT;Desenvolvido;1
CGRA;CI GLOBAL REAL ASSET PRIVATE;CGRA;CAD;ETF;CA;AEQLIT;Desenvolvido;1
CGRB;CI GLOBAL GREEN BOND FUND;CGRB;CAD;ETF;CA;AEQLIT;Desenvolvido;1
CGRE;CI GLOBAL REIT PRIVATE POOL;CGRE;CAD;ETF;CA;TSE*;Desenvolvido;1
CGRN;CI GL SUSTAINABLE INFRASTRUC;CGRN;CAD;ETF;CA;TSE*;Desenvolvido;1
CGRO;CI GRWTH ASSET ALLOC ETF;CGRO;CAD;ETF;CA;TSE*;Desenvolvido;1
CGSB;CI GLB SH-TRM BD-ETF;CGSB;CAD;ETF;CA;AEQLIT*;Desenvolvido;1
CGXF;CI GOLD GIANTS COVERED CALL;CGXF;CAD;ETF;CA;AEQLIT;Desenvolvido;1
CGXF.U;CI GOLD GIANTS COVERED CALL;CGXF.U;USD;ETF;CA;AEQLIT;Desenvolvido;0
CHCL.B;CI GLOBAL HEALTHCARE LEADERS;CHCL.B;CAD;ETF;CA;AEQLIT*;Desenvolvido;1
CHNA.B;CI ICBCCS S&P CHINA 500 INDE;CHNA.B;CAD;ETF;CA;TSE*;Desenvolvido;1
CHNTRAC11;CHNTRAC 11;CHNTRAC11;MXN;ETF;MX;MEXI*;Em Desenvolvimento;1
CHPS;GLOBAL X SEMICOND INDEX ETF;CHPS;CAD;ETF;CA;AEQLIT;Desenvolvido;1
CIAI;CI GLBL ARTIFICIAL INTEL ETF;CIAI;CAD;ETF;CA;AEQLIT;Desenvolvido;1
CIBR;FIRSTTRUST NASDAQ CYBERSECUR;CIBR;CAD;ETF;CA;TSE*;Desenvolvido;1
CIC;CI CANADIAN BANKS COVERED CA;CIC;CAD;ETF;CA;AEQLIT;Desenvolvido;1
CIE;ISHARES INTERNATIONAL FUNDAM;CIE;CAD;ETF;CA;AEQLIT*;Desenvolvido;1
CIEH;CIBC INT EQUITY INDX ETF-C H;CIEH;CAD;ETF;CA;AEQLIT;Desenvolvido;1
CIEI;CIBC INT EQUITY INDEX ETF;CIEI;CAD;ETF;CA;AEQLIT;Desenvolvido;1
CIEM;CI EMERGING MARKETS ALPHA;CIEM;CAD;ETF;CA;TSE*;Desenvolvido;1
CIF;ISHARES GLOBAL INFRASTRUCTUR;CIF;CAD;ETF;CA;AEQLIT;Desenvolvido;1
CINF;CI GLOBAL INFR PRIVATE POOL;CINF;CAD;ETF;CA;AEQLIT;Desenvolvido;1
CINT;CIBC INTERNATIONAL EQUITY ET;CINT;CAD;ETF;CA;AEQLIT;Desenvolvido;1
CINV;CI GLOBAL ALPHA INNOVATION;CINV;CAD;ETF;CA;AEQLIT;Desenvolvido;1
CJP;ISHARES JAPAN FUNDAMENTAL IN;CJP;CAD;ETF;CA;AEQLIT*;Desenvolvido;1
CLDN;SAVVYSHORT GEARED CRUDE OIL;CLDN;CAD;ETF;CA;TSE*;Desenvolvido;1
CLF;ISHARES 1-5 YEAR LADDERED GO;CLF;CAD;ETF;CA;TSE*;Desenvolvido;1
CLG;ISHARES 1-10 YEAR LADDERED G;CLG;CAD;ETF;CA;AEQLIT;Desenvolvido;1
CLML;CI GLOBAL CLIMATE LEADERS FD;CLML;CAD;ETF;CA;TSE*;Desenvolvido;1
CLU;ISHARES US FUNDAMENTAL INDEX;CLU;CAD;ETF;CA;AEQLIT*;Desenvolvido;1
CLU.C;ISHARES US FUNDAMEN-NON HEDG;CLU.C;CAD;ETF;CA;AEQLIT*;Desenvolvido;1
CLUP;SAVVYLONG GEARED CRUDE OIL;CLUP;CAD;ETF;CA;TSE*;Desenvolvido;1
CMAG;CI MUNRO ALTERNATIVE GLOBAL;CMAG;CAD;ETF;CA;AEQLIT;Desenvolvido;1
CMAR;CI MARRET ALTERNATIVE ABSOLU;CMAR;CAD;ETF;CA;AEQLIT;Desenvolvido;1
CMCX.B;CI GALAXY MULTI - CRYPTO E-B;CMCX.B;CAD;ETF;CA;TSE*;Desenvolvido;1
CMCX.U;CI GALAXY MULTI - CRYPTO ETF;CMCX.U;USD;ETF;CA;AEQLIT;Desenvolvido;0
CMDO;CI ALTERNATIVE DIVERSIFIED;CMDO;CAD;ETF;CA;TSE*;Desenvolvido;1
CMDO.U;CI ALTERNATIVE DIVERSIFIED O;CMDO.U;USD;ETF;CA;TSE*;Desenvolvido;0
CMEY;CI MARRET ALT ENH YIELD FUND;CMEY;CAD;ETF;CA;AEQLIT;Desenvolvido;1
CMGG;CI MUNRO GLOBAL GROWTH EQTY;CMGG;CAD;ETF;CA;TSE*;Desenvolvido;1
CMNY;CI MONEY MARKET ETF;CMNY;CAD;ETF;CA;TSE*;Desenvolvido;1
CMOM;CI US ENH MOMTM IND (HEDGED);CMOM;CAD;ETF;CA;AEQLIT;Desenvolvido;1
CMOM.B;CI US ENH MOMTM IND (UNHEDG);CMOM.B;CAD;ETF;CA;TSE*;Desenvolvido;1
CMR;ISHARES PREMIUM MONEY MARKET;CMR;CAD;ETF;CA;AEQLIT;Desenvolvido;1
CMVX;CI GALAXY METAVERSE INDEX ET;CMVX;CAD;ETF;CA;AEQLIT;Desenvolvido;1
CNAO;CI ALTERNATIVE NORTH AMERICA;CNAO;CAD;ETF;CA;AEQLIT;Desenvolvido;1
CNCC;GLB X S&P/TSX 60 COVERED ETF;CNCC;CAD;ETF;CA;AEQLIT;Desenvolvido;1
CNCL;GL X EN S&P/TSX 60CO CAL ETF;CNCL;CAD;ETF;CA;TSE*;Desenvolvido;1
CNDX;GLOBAL X S&P/TSX 60 IDX ETF;CNDX;CAD;ETF;CA;TSE*;Desenvolvido;1
CNV;FRK CONS INC ETF PORTFOLIO;CNV;CAD;ETF;CA;AEQLIT;Desenvolvido;1
COMM;BMO GLOBAL COMMUNICATIONS IN;COMM;CAD;ETF;CA;TSE*;Desenvolvido;1
COPJ;SPROTT JR COPPER MINERS ETF;COPJ;USD;ETF;CA;AMEX;Desenvolvido;0
COPP;GLOBAL X COPPER PRODUCER IND;COPP;CAD;ETF;CA;AEQLIT;Desenvolvido;1
CORE;PIMCO CANAD COR BND FND;CORE;CAD;ETF;CA;TSE*;Desenvolvido;1
COW;ISHARES GLOBAL AGRICULTURE I;COW;CAD;ETF;CA;AEQLIT;Desenvolvido;1
CPD;ISHARES S&P/TSX CANADIAN PRE;CPD;CAD;ETF;CA;AEQLIT;Desenvolvido;1
CPLS;CIBC CORE PLUS FI POOL ETF;CPLS;CAD;ETF;CA;TSE*;Desenvolvido;1
CQLC;CIBC QX CANADIAN LOW VOL DVD;CQLC;CAD;ETF;CA;AEQLIT*;Desenvolvido;1
CQLI;CIBC QX INT LOW VOL DVD ETF;CQLI;CAD;ETF;CA;AEQLIT*;Desenvolvido;1
CQLU;CIBC QX US LOW VOL DVD ETF;CQLU;CAD;ETF;CA;AEQLIT*;Desenvolvido;1
CRED;CI ALTERNATIVE INVESTMENT GR;CRED;CAD;ETF;CA;AEQLIT;Desenvolvido;1
CRED.U;CI LAWRENCE PARK ALT INVT US;CRED.U;USD;ETF;CA;AEQLIT;Desenvolvido;0
CROP;PURPOSE CREDIT OPPORTUNITIES;CROP;CAD;ETF;CA;AEQLIT;Desenvolvido;1
CRQ;ISHARES CANADIAN FUNDAMENTAL;CRQ;CAD;ETF;CA;AEQLIT*;Desenvolvido;1
CSAV;CI HIGH INTEREST SAVINGS ETF;CSAV;CAD;ETF;CA;AEQLIT;Desenvolvido;1
CSBA;CIBC SUSTAINABLE BALANCED SO;CSBA;CAD;ETF;CA;AEQLIT*;Desenvolvido;1
CSBG;CIBC SUSTAINABLE BALANCED GR;CSBG;CAD;ETF;CA;AEQLIT*;Desenvolvido;1
CSBI;CIBC CANADIAN SH-TRM BND ETF;CSBI;CAD;ETF;CA;AEQLIT;Desenvolvido;1
CSCB;CIBC SUSTAINABLE CONSERVATIV;CSCB;CAD;ETF;CA;AEQLIT*;Desenvolvido;1
CSCE;CIBC SUSTAINABLE CANADIAN EQ;CSCE;CAD;ETF;CA;AEQLIT*;Desenvolvido;1
CSCP;CIBC SUSTAINABLE CANADIAN CO;CSCP;CAD;ETF;CA;AEQLIT*;Desenvolvido;1
CSGE;CIBC SUSTAINABLE GLOBAL EQUI;CSGE;CAD;ETF;CA;AEQLIT*;Desenvolvido;1
CTBA;CIBC ASSET MANAGEMENT INC.;CTBA;CAD;ETF;CA;AEQLIT*;Desenvolvido;1
CTBB;CIBC ASSET MANAGEMENT INC.;CTBB;CAD;ETF;CA;AEQLIT*;Desenvolvido;1
CTBC;CIBC ASSET MANAGEMENT INC.;CTBC;CAD;ETF;CA;AEQLIT*;Desenvolvido;1
CTBD;CIBC ASSET MANAGEMENT INC.;CTBD;CAD;ETF;CA;AEQLIT*;Desenvolvido;1
CTBE;CIBC ASSET MANAGEMENT INC.;CTBE;CAD;ETF;CA;AEQLIT*;Desenvolvido;1
CTBF;CIBC ASSET MANAGEMENT INC.;CTBF;CAD;ETF;CA;AEQLIT*;Desenvolvido;1
CTIP;CI US TREASURY INFLATION-LIN;CTIP;CAD;ETF;CA;AEQLIT*;Desenvolvido;1
CTUC.U;CIBC ASSET MANAGEMENT INC.;CTUC.U;USD;ETF;CA;AEQLIT*;Desenvolvido;0
CTUD.U;CIBC ASSET MANAGEMENT INC.;CTUD.U;USD;ETF;CA;AEQLIT*;Desenvolvido;0
CTUE.U;CIBC ASSET MANAGEMENT INC.;CTUE.U;USD;ETF;CA;AEQLIT*;Desenvolvido;0
CUBD;CI GLB UNC BOND ETF;CUBD;CAD;ETF;CA;TSE*;Desenvolvido;1
CUD;ISHARES US DIVIDEND GROWERS;CUD;CAD;ETF;CA;TSE*;Desenvolvido;1
CUDV;CI US MIN DOWN VOL ETF HDG;CUDV;CAD;ETF;CA;TSE*;Desenvolvido;1
CUDV.B;CI US MIN DOWN VOL ETF UNHDG;CUDV.B;CAD;ETF;CA;AEQLIT;Desenvolvido;1
CUEH;CIBC US EQT IND CA HD ET-C H;CUEH;CAD;ETF;CA;TSE*;Desenvolvido;1
CUEI;CIBC US EQUITY INDEX ETF;CUEI;CAD;ETF;CA;AEQLIT;Desenvolvido;1
CUSA;CI US 500 INDEX ETF;CUSA;CAD;ETF;CA;AEQLIT*;Desenvolvido;1
CUSA.B;CI US 500 INDEX ETF;CUSA.B;CAD;ETF;CA;AEQLIT*;Desenvolvido;1
CUSM.B;CI US 1000 INDEX ETF;CUSM.B;CAD;ETF;CA;AEQLIT*;Desenvolvido;1
CUTL;CI UTIL GIANT COV CAL ETF-HC;CUTL;CAD;ETF;CA;AEQLIT;Desenvolvido;1
CUTL.B;CI UTIL GIANT COV CAL ETF-UH;CUTL.B;CAD;ETF;CA;AEQLIT;Desenvolvido;1
CVD;ISHARES CONVERTIBLE BOND IND;CVD;CAD;ETF;CA;AEQLIT;Desenvolvido;1
CVLU;CI US ENH VAL IND (HEDGED);CVLU;CAD;ETF;CA;TSE*;Desenvolvido;1
CVLU.B;CI US ENH VAL IND (UNHEDGED);CVLU.B;CAD;ETF;CA;AEQLIT;Desenvolvido;1
CWO;ISHARES EMERGING MARKETS FUN;CWO;CAD;ETF;CA;AEQLIT*;Desenvolvido;1
CWW;ISHARES GLOBAL WATER INDEX E;CWW;CAD;ETF;CA;AEQLIT;Desenvolvido;1
CXF;CI CANADIAN CONVERTIBLE BOND;CXF;CAD;ETF;CA;AEQLIT;Desenvolvido;1
CYBR;EVOLVE CYBER SECURITY INDEX;CYBR;CAD;ETF;CA;TSE*;Desenvolvido;1
CYBR.B;EVOLVE CYBER SECURITY INDEX;CYBR.B;CAD;ETF;CA;AEQLIT;Desenvolvido;1
CYH;ISHARES GLOBAL MONTHLY DIVID;CYH;CAD;ETF;CA;TSE*;Desenvolvido;1
CYLD;ML SMART ENHANCED YIELD ETF;CYLD;CAD;ETF;CA;AEQLIT*;Desenvolvido;1
DAMG;DESJ ALT LG/SHT GLB EQY ETF;DAMG;CAD;ETF;CA;AEQLIT;Desenvolvido;1
DANC;DESJARDINS ALT LONG/SHORT MT;DANC;CAD;ETF;CA;TSE*;Desenvolvido;1
DANC.U;DESJ ALT LG/SHT MKT NTRL USH;DANC.U;USD;ETF;CA;AEQLIT;Desenvolvido;0
DATA;EVOLVE CLOUD COMPUTING INDEX;DATA;CAD;ETF;CA;TSE*;Desenvolvido;1
DATA.B;EVOLVE CLOUD COMPUTING IN-B;DATA.B;CAD;ETF;CA;TSE*;Desenvolvido;1
DCBC;DESJARDINS CNDIN CP BN I ETF;DCBC;CAD;ETF;CA;AEQLIT;Desenvolvido;1
DCC;DESJARDINS 1-5 YR CAD CORP;DCC;CAD;ETF;CA;TSE*;Desenvolvido;1
DCG;DESJARDINS 1-5 YR LAT GOV BD;DCG;CAD;ETF;CA;AEQLIT;Desenvolvido;1
DCP;DESJARDINS CAD PREFERRED;DCP;CAD;ETF;CA;TSE*;Desenvolvido;1
DCS;DESJARDINS CAD SHORT TERM BD;DCS;CAD;ETF;CA;AEQLIT;Desenvolvido;1
DCU;DESJARDINS CAD UNIVERSE BOND;DCU;CAD;ETF;CA;TSE*;Desenvolvido;1
DGR;CI US QLT DVD GRWTH IDX ETF;DGR;CAD;ETF;CA;TSE*;Desenvolvido;1
DGR.B;CI US QLT DVD GRWTH IDX ETF;DGR.B;CAD;ETF;CA;AEQLIT;Desenvolvido;1
DGRC;CI CANADA QUALITY DIVIDEND G;DGRC;CAD;ETF;CA;TSE*;Desenvolvido;1
DIABLOI10;DIABLOI 10;DIABLOI10;MXN;ETF;MX;MEXI*;Em Desenvolvimento;1
DISC;BMO GLBL CONSUMER DISCRETION;DISC;CAD;ETF;CA;AEQLIT;Desenvolvido;1
DIVS;EVOLVE ACTIVE CANADIAN PREFE;DIVS;CAD;ETF;CA;TSE*;Desenvolvido;1
DLR;GLOBAL X US DOLLAR CURRENCY;DLR;CAD;ETF;CA;AEQLIT;Desenvolvido;1
DLR.U;GLOBAL X US DOLLAR CURRENCY;DLR.U;USD;ETF;CA;TSE*;Desenvolvido;0
DLRTRAC15;DOLAR TRAC;DLRTRAC15;MXN;ETF;MX;MEXI*;Em Desenvolvimento;1
DMEC;DESJARDINS CANDN EQU IN ETF;DMEC;CAD;ETF;CA;TSE*;Desenvolvido;1
DMEI;DESJARDINS INTERN EQ IN ETF;DMEI;CAD;ETF;CA;AEQLIT;Desenvolvido;1
DMEU;DESJARDINS AMRICAN EQ IN ETF;DMEU;CAD;ETF;CA;AEQLIT;Desenvolvido;1
DOTVE;VALOUR POLKADOT;DOTVE;EUR;ETF;KY;SBF*;Em Desenvolvimento;0
DRCU;DESJARDINS RI ACTIVE CANADIA;DRCU;CAD;ETF;CA;AEQLIT;Desenvolvido;1
DRFC;DESJARDINS RI CANADA MULTIFA;DRFC;CAD;ETF;CA;AEQLIT;Desenvolvido;1
DRFD;DESJARDINS RI DEVELOPED EX-U;DRFD;CAD;ETF;CA;TSE*;Desenvolvido;1
DRFE;DESJARDINS RI EMERGING MARKE;DRFE;CAD;ETF;CA;TSE*;Desenvolvido;1
DRFG;DESJARDINS GLB MF FOSS FUEL;DRFG;CAD;ETF;CA;TSE*;Desenvolvido;1
DRFU;DESJARDINS RI USA MULTIFACTO;DRFU;CAD;ETF;CA;TSE*;Desenvolvido;1
DRMC;DESJARDINS RI CANADA - NET-Z;DRMC;CAD;ETF;CA;TSE*;Desenvolvido;1
DRMD;DESJARDINS RI DEVELOPED EX-U;DRMD;CAD;ETF;CA;AEQLIT;Desenvolvido;1
DRME;DESJARDINS RI EMERGING MARKE;DRME;CAD;ETF;CA;TSE*;Desenvolvido;1
DRMU;DESJARDINS RI USA - NET-ZERO;DRMU;CAD;ETF;CA;AEQLIT;Desenvolvido;1
DSAE;DESJA SUS AMERICAN EQ ETF- A;DSAE;CAD;ETF;CA;TSE*;Desenvolvido;1
DXAU;DYNAMIC ACTIVE GLB GOLD ETF;DXAU;CAD;ETF;CA;AEQLIT;Desenvolvido;1
DXB;DYNAMIC ACTIVE TACTICAL BOND;DXB;CAD;ETF;CA;TSE*;Desenvolvido;1
DXBB;DYNAMIC ACTIVE BOND ETF;DXBB;CAD;ETF;CA;AEQLIT;Desenvolvido;1
DXBC;DYNAMIC ACTIVE CDN BOND ETF;DXBC;CAD;ETF;CA;AEQLIT;Desenvolvido;1
DXBG;DYNAMIC GLOBAL FIXED INC FD;DXBG;CAD;ETF;CA;AEQLIT;Desenvolvido;1
DXBU;DYNAMIC ACTIVE US IG BD ETF;DXBU;CAD;ETF;CA;AEQLIT;Desenvolvido;1
DXC;DYNAMIC ACTIVE CANADIAN DIVI;DXC;CAD;ETF;CA;TSE*;Desenvolvido;1
DXCB;DYNAMIC ACTIVE CORP BOND ETF;DXCB;CAD;ETF;CA;AEQLIT;Desenvolvido;1
DXCO;DYNAMIC CREDIT OPPORTUNIT FD;DXCO;CAD;ETF;CA;AEQLIT;Desenvolvido;1
DXCP;DYNAMIC ST CREDIT PLUS FD;DXCP;CAD;ETF;CA;TSE*;Desenvolvido;1
DXDB;DYNAMIC ACTV DISCOUNT BD ETF;DXDB;CAD;ETF;CA;AEQLIT;Desenvolvido;1
DXEM;DYNAMIC ACTIVE EMERGING MARK;DXEM;CAD;ETF;CA;TSE*;Desenvolvido;1
DXET;DYNAMIC ACTIVE ENERGY EVOLUT;DXET;CAD;ETF;CA;AEQLIT;Desenvolvido;1
DXF;DYNAMIC ACTIVE GLOBAL FINANC;DXF;CAD;ETF;CA;AEQLIT;Desenvolvido;1
DXG;DYNAMIC ACTIVE GLOBAL DIVIDE;DXG;CAD;ETF;CA;AEQLIT;Desenvolvido;1
DXGE;DYNAMIC ACT GLB EQU INC ETF;DXGE;CAD;ETF;CA;TSE*;Desenvolvido;1
DXIF;DYNAMIC ACTIVE INTERNATIONAL;DXIF;CAD;ETF;CA;AEQLIT;Desenvolvido;1
DXMO;DYNAMIC ACTIVE MNG OPP ETF;DXMO;CAD;ETF;CA;AEQLIT;Desenvolvido;1
DXN;DYNAMIC ACTIVE GLOBAL INFRAS;DXN;CAD;ETF;CA;AEQLIT;Desenvolvido;1
DXO;DYNAMIC ACTIVE CROSSOVER BON;DXO;CAD;ETF;CA;TSE*;Desenvolvido;1
DXP;DYNAMIC ACTIVE PREFERRED SHA;DXP;CAD;ETF;CA;AEQLIT;Desenvolvido;1
DXQ;DYNAMIC ACTV EN YLD OPT ETF;DXQ;CAD;ETF;CA;AEQLIT;Desenvolvido;1
DXR;DYNAMIC ACTIVE RETIREMENT IN;DXR;CAD;ETF;CA;AEQLIT;Desenvolvido;1
DXRE;DYNAMIC ACTIVE RE ETF;DXRE;CAD;ETF;CA;TSE*;Desenvolvido;1
DXU;DYNAMIC ACTIVE US DIVIDEND E;DXU;CAD;ETF;CA;AEQLIT;Desenvolvido;1
DXUS;DYNAMIC ACTIVE US EQUITY ETF;DXUS;CAD;ETF;CA;AEQLIT;Desenvolvido;1
DXV;DYNAMIC ACT UL SH TRM BN ETF;DXV;CAD;ETF;CA;TSE*;Desenvolvido;1
DXW;DYNAMIC ACTIVE INTERNATIONAL;DXW;CAD;ETF;CA;AEQLIT;Desenvolvido;1
DXZ;DYNAMIC ACTIVE US MID-CAP ET;DXZ;CAD;ETF;CA;TSE*;Desenvolvido;1
EACC;GLOBAL X MSCI EAFE CC ETF;EACC;CAD;ETF;CA;AEQLIT*;Desenvolvido;1
EACL;GBL X ENH MSCI EAFE CO C ETF;EACL;CAD;ETF;CA;AEQLIT*;Desenvolvido;1
EAFL;GLOBAL X EHD MSCI EF IDX ETF;EAFL;CAD;ETF;CA;AEQLIT*;Desenvolvido;1
EAFX;GLOBAL X MSCI EAFE INDEX ETF;EAFX;CAD;ETF;CA;AEQLIT*;Desenvolvido;1
EAFX.U;GLOBAL X MSCI EAFE INDEX ETF;EAFX.U;USD;ETF;CA;AEQLIT*;Desenvolvido;0
EARN;EVOLVE ACTIVE GLOBAL FIXED;EARN;CAD;ETF;CA;TSE*;Desenvolvido;1
EBIT;EVOLVE BITCOIN ETF;EBIT;CAD;ETF;CA;TSE*;Desenvolvido;1
EBIT.U;EVOLVE BITCOIN ETF USD;EBIT.U;USD;ETF;CA;TSE*;Desenvolvido;0
EBNK;EVOLV EURO BKS ENH YLD ETF;EBNK;CAD;ETF;CA;TSE*;Desenvolvido;1
EBNK.B;EVOLV EURO BKS ENH YLD ETF-B;EBNK.B;CAD;ETF;CA;AEQLIT;Desenvolvido;1
EDGE;EVOLVE INNOVATION INDEX FUND;EDGE;CAD;ETF;CA;TSE*;Desenvolvido;1
EDGE.U;EVOLVE INNOVATION INDEX-USD;EDGE.U;USD;ETF;CA;AEQLIT;Desenvolvido;0
EDGF;BROMPTON EUROPEAN DIVIDEND G;EDGF;CAD;ETF;CA;TSE*;Desenvolvido;1
EGIF;EXEMPLAR GROWTH AND INCOME E;EGIF;CAD;ETF;CA;AEQLIT;Desenvolvido;1
EHE;CI EUROPE HEDGED EQ INDX ETF;EHE;CAD;ETF;CA;AEQLIT;Desenvolvido;1
EHE.B;CI EUR HDG EQU INDX ETF;EHE.B;CAD;ETF;CA;TSE*;Desenvolvido;1
EMAX;HAMILTON ENERGY YIELD MAX;EMAX;CAD;ETF;CA;AEQLIT;Desenvolvido;1
EMCC;GLOBAL X MSCI EMCC ETF;EMCC;CAD;ETF;CA;AEQLIT*;Desenvolvido;1
EMCL;GBL X ENHANC MSCI EM CC ETF;EMCL;CAD;ETF;CA;AEQLIT*;Desenvolvido;1
EMML;GBL X ENH MSCI E MRK IND ETF;EMML;CAD;ETF;CA;AEQLIT*;Desenvolvido;1
EMMX;GLOBAL X MSCI EMR MRK IN ETF;EMMX;CAD;ETF;CA;AEQLIT*;Desenvolvido;1
EMMX.U;GLOBAL X MSCI EMR MRK IN ETF;EMMX.U;USD;ETF;CA;AEQLIT*;Desenvolvido;0
EMV.B;CI EMERGING MARKETS DIVIDEND;EMV.B;CAD;ETF;CA;TSE*;Desenvolvido;1
ENCC;GLOBAL X CANADIAN OIL AND GA;ENCC;CAD;ETF;CA;AEQLIT;Desenvolvido;1
ENCL;GBL X EN CA OIL&GAS EQ C ETF;ENCL;CAD;ETF;CA;AEQLIT;Desenvolvido;1
EQCC;GBL X ALL-EQ AST ALL CC ETF;EQCC;CAD;ETF;CA;TSE*;Desenvolvido;1
EQCL;GLB X EN ALL-EQ AS AL CO ETF;EQCL;CAD;ETF;CA;TSE*;Desenvolvido;1
EQE;INVESCO S&P EU 350 EQL WGHT;EQE;CAD;ETF;CA;AEQLIT*;Desenvolvido;1
EQE.F;INVESCO S&P EU 350-HEDGED;EQE.F;CAD;ETF;CA;AEQLIT*;Desenvolvido;1
EQL;INVESCO S&P 500 EQL WGHT ETF;EQL;CAD;ETF;CA;TSE*;Desenvolvido;1
EQL.F;INVESCO S&P 500 EQL WGHT ETF;EQL.F;CAD;ETF;CA;TSE*;Desenvolvido;1
EQL.U;INVESCO S&P 500 EQL WGHT ETF;EQL.U;USD;ETF;CA;AEQLIT;Desenvolvido;0
EQLI;INVZ S&P 500 EW INCM AD ETF;EQLI;CAD;ETF;CA;AEQLIT;Desenvolvido;1
EQY;FRANKLIN ALL-EQUITY ETF PORT;EQY;CAD;ETF;CA;TSE*;Desenvolvido;1
ESG;INVESCO S&P 500 ESG INDEX ET;ESG;CAD;ETF;CA;TSE*;Desenvolvido;1
ESG.F;INVESCO S&P 500 ESG INDEX HG;ESG.F;CAD;ETF;CA;TSE*;Desenvolvido;1
ESGA;BMO MSCI CANADA ESG LEADERS;ESGA;CAD;ETF;CA;AEQLIT;Desenvolvido;1
ESGB;BMO ESG CORPORATE BOND INDEX;ESGB;CAD;ETF;CA;AEQLIT;Desenvolvido;1
ESGC;INVESCO S&P/TSX COMP ESG IND;ESGC;CAD;ETF;CA;AEQLIT;Desenvolvido;1
ESGE;BMO MSCI EAFE ESG LEADERS IN;ESGE;CAD;ETF;CA;AEQLIT;Desenvolvido;1
ESGF;BMO ESG US CORPORATE BOND CA;ESGF;CAD;ETF;CA;TSE*;Desenvolvido;1
ESGG;BMO MSCI GLOBAL ESG LEADERS;ESGG;CAD;ETF;CA;AEQLIT;Desenvolvido;1
ESGH;BMO ESG HIGH YIELD US CORP;ESGH;CAD;ETF;CA;AEQLIT;Desenvolvido;1
ESGH.F;BMO ESG HIGH YIELD US CORPOR;ESGH.F;CAD;ETF;CA;AEQLIT;Desenvolvido;1
ESGMEX IS;ISHARES ESG MSCI MEXICO ETF;ESGMEX ISHRS;MXN;ETF;MX;MEXI*;Em Desenvolvimento;1
ESGY;BMO MSCI USA ESG LEADERS IND;ESGY;CAD;ETF;CA;TSE*;Desenvolvido;1
ESGY.F;BMO MSCI USA ESG LD IND-HEDG;ESGY.F;CAD;ETF;CA;AEQLIT;Desenvolvido;1
ESPX;EVOLVE S&P 500 ENHANCED FUND;ESPX;CAD;ETF;CA;AEQLIT;Desenvolvido;1
ESPX.B;EVOLVE S&P 500 ENHANCED FUND;ESPX.B;CAD;ETF;CA;TSE*;Desenvolvido;1
ETC;EVOLVE CRYPTOCURRENCIES ETF;ETC;CAD;ETF;CA;TSE*;Desenvolvido;1
