SYMBOL;DESCRIPTION;IBKR SYMBOL;CURRENCY;PRODUCT;REGION;EXCHANGE *PRIMARY EXCHANGE;Classificação Econômica;inloco
PEY;INVESCO HIGH YIELD EQUITY DI;PEY;USD;ETF;US;ISLAND;Desenvolvido;1
PEZ;INVESCO DORSEY WRIGHT CONSUM;PEZ;USD;ETF;US;DRCTEDGE;Desenvolvido;1
PFEB;INNOVATOR U.S. EQUITY POWER;PFEB;USD;ETF;US;BEX;Desenvolvido;1
PFF;ISHARES PREFERRED & INCOME S;PFF;USD;ETF;US;NYSENAT;Desenvolvido;1
PFF;ISHARES PREFERRED & INCOME S;PFF;MXN;ETF;US;MEXI*;Desenvolvido;0
PFFA;VIRTUS INFRACAP US PREF STCK;PFFA;USD;ETF;US;CHX;Desenvolvido;1
PFFD;GLOBAL X US PREFERRED ETF;PFFD;USD;ETF;US;EDGEA;Desenvolvido;1
PFFD;GLOBAL X US PREFERRED ETF;PFFD;MXN;ETF;US;MEXI*;Desenvolvido;0
PFFL;ETRACS MON PAY 2XLEV PREFER;PFFL;USD;ETF;US;LTSE;Desenvolvido;1
PFFR;INFRACAP REIT PREFERRED ETF;PFFR;USD;ETF;US;NYSENAT;Desenvolvido;1
PFFV;GLOBAL X VARIABLE RATE PREF;PFFV;USD;ETF;US;IEX;Desenvolvido;1
PFFV;GLOBAL X VARIABLE RATE PREF;PFFV;MXN;ETF;US;MEXI*;Desenvolvido;0
PFI;INVESCO DORSEY WRIGHT FINANC;PFI;USD;ETF;US;BATS;Desenvolvido;1
PFIG;INVESCO FUNDAMENTAL INVESTME;PFIG;USD;ETF;US;LTSE;Desenvolvido;1
PFIX;SIMPLIFY INTEREST RATE HEDGE;PFIX;USD;ETF;US;PSX;Desenvolvido;1
PFLD;AAM LOW DUR PREF & INC SEC;PFLD;USD;ETF;US;MEMX;Desenvolvido;1
PFM;INVESCO DIVIDEND ACHIEVERS E;PFM;USD;ETF;US;NASDAQ*;Desenvolvido;1
PFRL;PGIM FLOATING RATE INCOME ET;PFRL;USD;ETF;US;ISLAND;Desenvolvido;1
PFUT;PUTNAM SUSTAINABLE FUTURE;PFUT;USD;ETF;US;BYX;Desenvolvido;1
PFXF;VANECK PREF SEC X-FINANCIALS;PFXF;USD;ETF;US;ISLAND;Desenvolvido;1
PGF;INVESCO FINANCIAL PREFERRED;PGF;USD;ETF;US;CHX;Desenvolvido;1
PGHY;INVESCO GLOBAL EX US HIGH YI;PGHY;USD;ETF;US;PSX;Desenvolvido;1
PGJ;INVESCO GOLDEN DRAGON CHINA;PGJ;USD;ETF;US;EDGEA;Desenvolvido;1
PGMFF;IPATH BLOOMBERG PLATINUM SUB;PGMFF;USD;ETF;US;OTCLNKECN;Desenvolvido;1
PGRO;PUTNAM FOCUSED LRG CAP GROW;PGRO;USD;ETF;US;AMEX;Desenvolvido;1
PGX;INVESCO PREFERRED ETF;PGX;USD;ETF;US;DRCTEDGE;Desenvolvido;1
PHB;INVESCO FUNDAMENTAL HIGH YIE;PHB;USD;ETF;US;AMEX;Desenvolvido;1
PHDG;INVESCO S&P 500 DOWNSIDE HED;PHDG;USD;ETF;US;EDGEA;Desenvolvido;1
PHEQ;PARAMETRIC HEDGED EQUITY ETF;PHEQ;USD;ETF;US;MEMX;Desenvolvido;1
PHO;INVESCO WATER RESOURCES ETF;PHO;USD;ETF;US;MEMX;Desenvolvido;1
PHYD;PUTNAM ESG HIGH YIELD ETF;PHYD;USD;ETF;US;IBEOS;Desenvolvido;1
PHYL;PGIM ACTIVE HIGH YIELD BOND;PHYL;USD;ETF;US;LTSE;Desenvolvido;1
PICB;INVESCO INTERNATIONAL CORPOR;PICB;USD;ETF;US;DRCTEDGE;Desenvolvido;1
PICK;ISHARES MSCI GLOBAL METALS &;PICK;USD;ETF;US;BEX;Desenvolvido;1
PICK;ISHARES MSCI GLOBAL METALS &;PICK;MXN;ETF;US;MEXI*;Desenvolvido;0
PID;INVESCO INTERNATIONAL DIVIDE;PID;USD;ETF;US;CHX;Desenvolvido;1
PIE;INVESCO DORSEY WRIGHT EMERGI;PIE;USD;ETF;US;AMEX;Desenvolvido;1
PIEQ;PRINCIPAL INTL EQTY ETF;PIEQ;USD;ETF;US;BEX;Desenvolvido;1
PIFI;CLEARSHARES PITON INT FI ETF;PIFI;USD;ETF;US;CHX;Desenvolvido;1
PILL;DIREXION DLY PHARMA BULL 3X;PILL;USD;ETF;US;OVERNIGHT;Desenvolvido;1
PIN;INVESCO INDIA EXCHANGE-TRADE;PIN;USD;ETF;US;NYSEFLOOR;Desenvolvido;1
PINK;SIMPLIFY HEALTH CARE ETF;PINK;USD;ETF;US;DRCTEDGE;Desenvolvido;1
PIO;INVESCO GLOBAL WATER ETF;PIO;USD;ETF;US;NYSENAT;Desenvolvido;1
PIT;VANECK COMMODITY STRAT ETF;PIT;USD;ETF;US;AMEX;Desenvolvido;1
PIZ;INVESCO DORSEY WRIGHT DEVELO;PIZ;USD;ETF;US;MEMX;Desenvolvido;1
PJAN;INNOVATOR U.S. EQUITY POWER;PJAN;USD;ETF;US;LTSE;Desenvolvido;1
PJBF;PGIM JENNISON BETTER FUTURE;PJBF;USD;ETF;US;OVERNIGHT;Desenvolvido;1
PJFG;PGIM JENNISON FOCUSED GROWTH;PJFG;USD;ETF;US;NYSE;Desenvolvido;1
PJFM;PGIM JENNISON FOCUSED MIDCAP;PJFM;USD;ETF;US;NYSENAT;Desenvolvido;1
PJFV;PGIM JENNISON FOCUSED VALUE;PJFV;USD;ETF;US;BEX;Desenvolvido;1
PJIO;PGIM JENNISON INTERNAT OPPOR;PJIO;USD;ETF;US;NYSENAT;Desenvolvido;1
PJP;INVESCO PHARMACEUTICALS ETF;PJP;USD;ETF;US;IEX;Desenvolvido;1
PJUL;INNOVATOR U.S. EQUITY POWER;PJUL;USD;ETF;US;AMEX;Desenvolvido;1
PJUN;INNOVATOR U.S. EQUITY POWER;PJUN;USD;ETF;US;LTSE;Desenvolvido;1
PKB;INVESCO BUILDING & CONSTRUCT;PKB;USD;ETF;US;LTSE;Desenvolvido;1
PKW;INVESCO BUYBACK ACHIEVERS ET;PKW;USD;ETF;US;NASDAQ*;Desenvolvido;1
PLDR;PUTNAM SUSTAINABLE LEADERS;PLDR;USD;ETF;US;ARCA*;Desenvolvido;1
PLTD;DIREXION DLY PLTR BEAR 1X SH;PLTD;USD;ETF;US;CHX;Desenvolvido;1
PLTM;GRANITESHARES PLATINUM TRUST;PLTM;USD;ETF;US;DRCTEDGE;Desenvolvido;1
PLTU;DIREXION DLY PLTR BULL 2X SH;PLTU;USD;ETF;US;BEX;Desenvolvido;1
PLTY;YIELDMAX PLTR OPTION INC ETF;PLTY;USD;ETF;US;IBEOS;Desenvolvido;1
PMAR;INNOVATOR U.S. EQUITY POWER;PMAR;USD;ETF;US;AMEX;Desenvolvido;1
PMAY;INNOVATOR U.S. EQUITY POWER;PMAY;USD;ETF;US;BYX;Desenvolvido;1
PMBS;PIMCO MBS ACTIVE ETF;PMBS;USD;ETF;US;BEX;Desenvolvido;1
PMIO;PGIM MUNICIPAL INC OPP ETF;PMIO;USD;ETF;US;ARCA*;Desenvolvido;1
PMJA;PGIM S&P 500 MB ETF - JAN;PMJA;USD;ETF;US;OVERNIGHT;Desenvolvido;1
PNOV;INNOVATOR U.S. EQUITY POWER;PNOV;USD;ETF;US;BEX;Desenvolvido;1
PNQI;INVESCO NASDAQ INTERNET ETF;PNQI;USD;ETF;US;NASDAQ*;Desenvolvido;1
POCT;INNOVATOR U.S. EQUITY POWER;POCT;USD;ETF;US;NYSENAT;Desenvolvido;1
POWA;INVESCO BLOOMBERG PRICING PO;POWA;USD;ETF;US;AMEX;Desenvolvido;1
PP;MEET KEVIN PRICING POWER ETF;PP;USD;ETF;US;ARCA*;Desenvolvido;1
PPA;INVESCO AEROSPACE & DEFENSE;PPA;USD;ETF;US;ARCA*;Desenvolvido;1
PPEM;PUTNAM PANAGORA ESG EMER EQ;PPEM;USD;ETF;US;LTSE;Desenvolvido;1
PPH;VANECK PHARMACEUTICAL ETF;PPH;MXN;ETF;US;MEXI*;Desenvolvido;0
PPH;VANECK PHARMACEUTICAL ETF;PPH;USD;ETF;US;BATS;Desenvolvido;1
PPI;AXS ASTORIA RE AS ETF-USDINC;PPI;USD;ETF;US;DRCTEDGE;Desenvolvido;1
PPIE;PUTNAM PANAGORA ESG INT EQ;PPIE;USD;ETF;US;CHX;Desenvolvido;1
PPLT;ABRDN PHYSICAL PLATINUM SHRS;PPLT;USD;ETF;US;IEX;Desenvolvido;1
PPTY;US DIVERSIFIED REAL ESTATE E;PPTY;USD;ETF;US;DRCTEDGE;Desenvolvido;1
PQAP;PGIM NSQ-100 B12 ETF - APRIL;PQAP;USD;ETF;US;NYSE;Desenvolvido;1
PQDI;PRINCIPAL SPEC T/A DVD ETF;PQDI;USD;ETF;US;BATS;Desenvolvido;1
PQJA;PGIM NDQ-100 BUFR 12 ETF JAN;PQJA;USD;ETF;US;CHX;Desenvolvido;1
PQJL;PGIM NSDQ-100 B 12 ETF - JUL;PQJL;USD;ETF;US;AMEX;Desenvolvido;1
PQOC;PGIM NASDAQ-100 B12 ETF OCT;PQOC;USD;ETF;US;AMEX;Desenvolvido;1
PRAE;PLANROCK ALTERNATIVE GRT ETF;PRAE;USD;ETF;US;DRCTEDGE;Desenvolvido;1
PRAY;FIS CHRISTIAN STOCK FUND-USD;PRAY;USD;ETF;US;DRCTEDGE;Desenvolvido;1
PRCS;PARNASSUS CORE SELECT ETF;PRCS;USD;ETF;US;ARCA;Desenvolvido;1
PREF;PRINCIPAL SPEC PR SEC ETF;PREF;USD;ETF;US;NYSE;Desenvolvido;1
PRF;INVESCO FTSE RAFI US 1000 ET;PRF;USD;ETF;US;MEMX;Desenvolvido;1
PRFD;PIMCO PREF AND CAP SEC ACT;PRFD;USD;ETF;US;AMEX;Desenvolvido;1
PRFZ;INVESCO FTSE RAFI US 1500 SM;PRFZ;USD;ETF;US;LTSE;Desenvolvido;1
PRMN;PLANROCK MARKET NEUT INC ETF;PRMN;USD;ETF;US;DRCTEDGE;Desenvolvido;1
PRN;INVESCO DORSEY WRIGHT INDUS;PRN;USD;ETF;US;BEX;Desenvolvido;1
PRNT;THE 3D PRINTING ETF;PRNT;USD;ETF;US;CHX;Desenvolvido;1
PRVS;PARNASSUS VALUE SELECT ETF;PRVS;USD;ETF;US;EDGEA;Desenvolvido;1
PSC;PRINCIPAL U.S. SMALL-CAP ETF;PSC;USD;ETF;US;BEX;Desenvolvido;1
PSC;PRINCIPAL U.S. SMALL-CAP ETF;PSC;MXN;ETF;US;MEXI*;Desenvolvido;0
PSCC;INVESCO S&P SMALLCAP CONSUME;PSCC;USD;ETF;US;IEX;Desenvolvido;1
PSCD;INVESCO S&P SMALLCAP CONSUME;PSCD;USD;ETF;US;BEX;Desenvolvido;1
PSCE;INVESCO S&P SMALLCAP ENERGY;PSCE;USD;ETF;US;PEARL;Desenvolvido;1
PSCF;INVESCO S&P SMALLCAP FINANCI;PSCF;USD;ETF;US;EDGEA;Desenvolvido;1
PSCH;INVESCO S&P SMALLCAP HEALTH;PSCH;USD;ETF;US;CBOE;Desenvolvido;1
PSCI;INVESCO S&P SMALLCAP INDUSTR;PSCI;USD;ETF;US;AMEX;Desenvolvido;1
PSCJ;PACER SWAN SOS CONSERVATIVE;PSCJ;USD;ETF;US;ARCA;Desenvolvido;1
PSCM;INVESCO S&P SMALLCAP MATERIA;PSCM;USD;ETF;US;IEX;Desenvolvido;1
PSCQ;PACER SWAN SOS CONS OCT ETF;PSCQ;USD;ETF;US;NYSE;Desenvolvido;1
PSCT;INVESCO S&P SMALLCAP INFORMA;PSCT;USD;ETF;US;DRCTEDGE;Desenvolvido;1
PSCU;INVESCO S&P S C U&C SER ETF;PSCU;USD;ETF;US;DRCTEDGE;Desenvolvido;1
PSCW;PACER SWAN SOS CONSERV APR;PSCW;USD;ETF;US;AMEX;Desenvolvido;1
PSCX;PACER SWAN SOS CONSERVATIVE;PSCX;USD;ETF;US;BEX;Desenvolvido;1
PSDM;PGIM SHRT DURATION MS BD ETF;PSDM;USD;ETF;US;IEX;Desenvolvido;1
PSEP;INNOVATOR U.S. EQUITY POWER;PSEP;USD;ETF;US;BATS*;Desenvolvido;1
PSET;PRINCIPAL QUALITY ETF;PSET;USD;ETF;US;NYSENAT;Desenvolvido;1
PSFD;PACER SWAN SOS FLEX JANUARY;PSFD;USD;ETF;US;AMEX;Desenvolvido;1
PSFF;PACER SWAN SOS FUND OF FUNDS;PSFF;USD;ETF;US;OVERNIGHT;Desenvolvido;1
PSFJ;PACER SWAN SOS FLEX JULY ETF;PSFJ;USD;ETF;US;BATS*;Desenvolvido;1
PSFM;PACER SWAN SOS FLEX APRIL;PSFM;USD;ETF;US;NYSE;Desenvolvido;1
PSFO;PACER SWAN SOS FLEX OCT ETF;PSFO;USD;ETF;US;BEX;Desenvolvido;1
PSH;PGIM SHORT DURATION HIGH YLD;PSH;USD;ETF;US;AMEX;Desenvolvido;1
PSI;INVESCO SEMICONDUCTORS ETF;PSI;USD;ETF;US;BEX;Desenvolvido;1
PSIL;ADVISORSHARES PSYCHEDELICS;PSIL;USD;ETF;US;BEX;Desenvolvido;1
PSK;SPDR ICE PREFERRED SECURITIE;PSK;USD;ETF;US;BEX;Desenvolvido;1
PSL;INVESCO DORSEY WRIGHT CONSUM;PSL;USD;ETF;US;DRCTEDGE;Desenvolvido;1
PSMD;PACER SWAN SOS MODERATE JANU;PSMD;USD;ETF;US;DRCTEDGE;Desenvolvido;1
PSMJ;PACER SWAN SOS MODERATE JULY;PSMJ;USD;ETF;US;IEX;Desenvolvido;1
PSMO;PACER SWAN SOS MOD OCT ETF;PSMO;USD;ETF;US;OVERNIGHT;Desenvolvido;1
PSMR;PACER SWAN SOS MODERATE APR;PSMR;USD;ETF;US;EDGEA;Desenvolvido;1
PSP;INVESCO GLOBAL LISTED PRIVAT;PSP;USD;ETF;US;CBOE;Desenvolvido;1
PSQ;PROSHARES SHORT QQQ;PSQ;USD;ETF;US;PSX;Desenvolvido;1
PSQA;PLMR SQ SENIOR DEBT ETF;PSQA;USD;ETF;US;BATS;Desenvolvido;1
PSQO;PLMR SQ CREDIT OPP ETF;PSQO;USD;ETF;US;PHLX;Desenvolvido;1
PSR;INVESCO ACTIVE US REAL ESTAT;PSR;USD;ETF;US;BEX;Desenvolvido;1
PST;PROSHARES ULTRASHORT 7-10 YR;PST;USD;ETF;US;AMEX;Desenvolvido;1
PSTP;INNOVATOR PWR BUFF SU ST ETF;PSTP;USD;ETF;US;EDGEA;Desenvolvido;1
PSTR;PEAKSHARES SECTOR ROTAT ETF;PSTR;USD;ETF;US;BATS;Desenvolvido;1
PSWD;XTRACKERS CYBERSECURITY ETF;PSWD;USD;ETF;US;BEX;Desenvolvido;1
PTBD;PACER TRENDPILOT US BOND ETF;PTBD;USD;ETF;US;IEX;Desenvolvido;1
PTEC;GLOBAL X PROPTECH ETF;PTEC;USD;ETF;US;CHX;Desenvolvido;1
PTEC;GLOBAL X PROPTECH ETF;PTEC;MXN;ETF;US;MEXI*;Desenvolvido;0
PTEU;PACER TRENDPILOT EUROPEAN ET;PTEU;USD;ETF;US;IEX;Desenvolvido;1
PTF;INVESCO DORSEY WRIGHT TECH;PTF;USD;ETF;US;LTSE;Desenvolvido;1
PTH;INVESCO DORSEY WRIGHT HEALTH;PTH;USD;ETF;US;LTSE;Desenvolvido;1
PTIN;PACER TRENDPILOT INTL ETF;PTIN;USD;ETF;US;AMEX;Desenvolvido;1
PTIR;GRANITESHARES 2X PLTR ETF;PTIR;USD;ETF;US;EDGX;Desenvolvido;1
PTL;INSPIRE 500 ETF;PTL;USD;ETF;US;ISE;Desenvolvido;1
PTLC;PACER TRENDPILOT US LARGE CA;PTLC;USD;ETF;US;IEX;Desenvolvido;1
PTMC;PACER TRENDPILOT US MID CAP;PTMC;USD;ETF;US;AMEX;Desenvolvido;1
PTNQ;PACER TRENDPILOT 100 ETF;PTNQ;USD;ETF;US;NYSENAT;Desenvolvido;1
PTRB;PGIM TOTAL RETURN BOND ETF;PTRB;USD;ETF;US;BYX;Desenvolvido;1
PUI;INVESCO DORSEY WRIGHT UTILIT;PUI;USD;ETF;US;DRCTEDGE;Desenvolvido;1
PULS;PGIM ULTRA SHORT BOND ETF;PULS;USD;ETF;US;AMEX;Desenvolvido;1
PULT;PUTNAM ESG ULTRA SHORT ETF;PULT;USD;ETF;US;DRCTEDGE;Desenvolvido;1
PUSH;PGIM ULTRA SHRT MNPL BND ETF;PUSH;USD;ETF;US;IEX;Desenvolvido;1
PUTD;CBOE VALIDUS SP500 DY PW IND;PUTD;USD;ETF;US;BEX;Desenvolvido;1
PUTW;WISDOMTREE PUTWRITE STRATEGY;PUTW;USD;ETF;US;MEMX;Desenvolvido;1
PUTW;WISDOMTREE PUTWRITE STRATEGY;PUTW;MXN;ETF;US;MEXI*;Desenvolvido;0
PVAL;PUTNAM FOCUSED LRG CAP VALUE;PVAL;USD;ETF;US;IBEOS;Desenvolvido;1
PVI;INVESCO FLOATING RATE MUNICI;PVI;USD;ETF;US;IEX;Desenvolvido;1
PWB;INVESCO LARGE CAP GROWTH ETF;PWB;USD;ETF;US;IEX;Desenvolvido;1
PWER;MACQUR ENG TRAN ETF;PWER;USD;ETF;US;AMEX;Desenvolvido;1
PWS;PACER WEALTHSHIELD ETF;PWS;USD;ETF;US;BEX;Desenvolvido;1
PWV;INVESCO LARGE CAP VALUE ETF;PWV;USD;ETF;US;DRCTEDGE;Desenvolvido;1
PWZ;INVESCO CALIFORNIA AMT-FREE;PWZ;USD;ETF;US;EDGEA;Desenvolvido;1
PXE;INVESCO ENERGY EXPLORATION;PXE;USD;ETF;US;EDGEA;Desenvolvido;1
PXF;INVESCO FTSE RAFI DEVELOPED;PXF;USD;ETF;US;DRCTEDGE;Desenvolvido;1
PXH;INVESCO FTSE RAFI EMERGING M;PXH;USD;ETF;US;PHLX;Desenvolvido;1
PXI;INVESCO DORSEY WRIGHT ENERGY;PXI;USD;ETF;US;NYSE;Desenvolvido;1
PXJ;INVESCO OIL & GAS SERVICES E;PXJ;USD;ETF;US;DRCTEDGE;Desenvolvido;1
PY;PRINCIPAL VALUE ETF;PY;USD;ETF;US;EDGEA;Desenvolvido;1
PYLD;PIMCO MULTISECTOR BOND ACTV;PYLD;USD;ETF;US;DRCTEDGE;Desenvolvido;1
PYPY;YLDMX PYPL OP INC STRTG ETF;PYPY;USD;ETF;US;BEX;Desenvolvido;1
PYZ;INVESCO DORSEY WRIGHT BASIC;PYZ;USD;ETF;US;DRCTEDGE;Desenvolvido;1
PZA;INVESCO NATIONAL AMT-FREE MU;PZA;USD;ETF;US;IEX;Desenvolvido;1
PZT;INVESCO NEW YORK AMT-FREE MU;PZT;USD;ETF;US;BEX;Desenvolvido;1
QABA;FIRST TRUST NASDAQ ABA CBIF;QABA;USD;ETF;US;DRCTEDGE;Desenvolvido;1
QAI;NYLI HDG MLT-STR TRC ETF-USD;QAI;USD;ETF;US;BEX;Desenvolvido;1
QARP;DBX ETF TRUST - XTRACKERS RU;QARP;USD;ETF;US;BEX;Desenvolvido;1
QAT;ISHARES MSCI QATAR ETF;QAT;USD;ETF;US;DRCTEDGE;Desenvolvido;1
QAT;ISHARES MSCI QATAR ETF;QAT;MXN;ETF;US;MEXI*;Desenvolvido;0
QBER;TRUESHARES QUARTLY B HDG ETF;QBER;USD;ETF;US;EDGEA;Desenvolvido;1
QBIG;INVESCO TOP QQQ ETF;QBIG;USD;ETF;US;BATS;Desenvolvido;1
QBUF;INNV NASDAQ -100 10 B - QRT;QBUF;USD;ETF;US;BEX;Desenvolvido;1
QBUL;TRUESHARE QRT BULL HDGE ETF;QBUL;USD;ETF;US;NYSENAT;Desenvolvido;1
QCAP;FT NSDQ100CONSBUFFETF - APR;QCAP;USD;ETF;US;AMEX;Desenvolvido;1
QCJL;FT NSDQ 100 CN BUFF ETF-JUL;QCJL;USD;ETF;US;NYSENAT;Desenvolvido;1
QCLN;FIRST TRUST NASDAQ CLEAN EDG;QCLN;USD;ETF;US;BATS;Desenvolvido;1
QCLN;FIRST TRUST NASDAQ CLEAN EDG;QCLN;MXN;ETF;US;MEXI*;Desenvolvido;0
QCLR;GLOBAL X NASDAQ 100 COLLAR 9;QCLR;USD;ETF;US;AMEX;Desenvolvido;1
QCOC;FT NDQ100 CNS BUFF ETF - OCT;QCOC;USD;ETF;US;EDGEA;Desenvolvido;1
QCON;AMERICAN CENT QUAL CONVT SEC;QCON;USD;ETF;US;BEX;Desenvolvido;1
QDCC;GBL X S&P 500 Q DVD CC ETF;QDCC;USD;ETF;US;NYSENAT;Desenvolvido;1
QDEC;FT VEST NASDAQ-100 BUFFER ET;QDEC;USD;ETF;US;BEX;Desenvolvido;1
QDEF;FLEXSHARES QUALITY DIVIDEND;QDEF;USD;ETF;US;NYSE;Desenvolvido;1
QDF;FLEXSHARES QUALITY DIVIDEND;QDF;USD;ETF;US;DRCTEDGE;Desenvolvido;1
QDIV;GLOBAL X S&P 500 QLTY DIV;QDIV;USD;ETF;US;CHX;Desenvolvido;1
QDIV;GLOBAL X S&P 500 QLTY DIV;QDIV;MXN;ETF;US;MEXI*;Desenvolvido;0
QDPL;PACER MET US LRG CAP DVD 400;QDPL;USD;ETF;US;IEX;Desenvolvido;1
QDTE;ROUNDHILL INNOVATION-100 0DT;QDTE;USD;ETF;US;PEARL;Desenvolvido;1
QDVO;AMPLIFY CWP GRTH & INCME ETF;QDVO;USD;ETF;US;BATS;Desenvolvido;1
QEFA;SPDR MSCI EAFE STRATEGICFACT;QEFA;USD;ETF;US;NYSE;Desenvolvido;1
QEMM;SPDR MSCI EMERGING MARKETS S;QEMM;USD;ETF;US;AMEX;Desenvolvido;1
QEMM;SPDR MSCI EMERGING MARKETS S;QEMM;MXN;ETF;US;MEXI*;Desenvolvido;0
QETH;INVESCO GALAXY ETH ETF;QETH;USD;ETF;US;IEX;Desenvolvido;1
QFLR;INNOVATOR NASDAQ-100 MF ETF;QFLR;USD;ETF;US;EDGEA;Desenvolvido;1
QGRO;AMERICAN CENTURY US QUALITY;QGRO;USD;ETF;US;LTSE;Desenvolvido;1
QGRW;WISDOMTREE US QUALITY GROWTH;QGRW;USD;ETF;US;CHX;Desenvolvido;1
QGRW;WISDOMTREE US QUALITY GROWTH;QGRW;MXN;ETF;US;MEXI*;Desenvolvido;0
QHDG;INNOVATOR HDGD NASDAQ100 ETF;QHDG;USD;ETF;US;AMEX;Desenvolvido;1
QHY;WISDOMTREE US HIGH YIELD COR;QHY;USD;ETF;US;ARCA;Desenvolvido;1
QID;PROSHARES ULTRASHORT QQQ;QID;USD;ETF;US;ARCA*;Desenvolvido;1
QIDX;INDXPERTS QLTY EARN FCUS ETF;QIDX;USD;ETF;US;IEX;Desenvolvido;1
QIG;WISDOMTREE US CORPORATE BOND;QIG;USD;ETF;US;BEX;Desenvolvido;1
QINT;AMERICAN CENTURY QLTY DIVER;QINT;USD;ETF;US;EDGEA;Desenvolvido;1
QIS;SIMPLIFY MULTI-QIS ALT ETF;QIS;USD;ETF;US;IEX;Desenvolvido;1
QJUN;FT VEST NASDAQ-100 BUFFER ET;QJUN;USD;ETF;US;EDGEA;Desenvolvido;1
QLC;FLEXSHARES US QUALITY LG CAP;QLC;USD;ETF;US;NYSENAT;Desenvolvido;1
QLD;PROSHARES ULTRA QQQ;QLD;USD;ETF;US;AMEX;Desenvolvido;1
QLTA;ISHARES AAA - A RATED CORPOR;QLTA;USD;ETF;US;ISE;Desenvolvido;1
QLTA;ISHARES AAA - A RATED CORPOR;QLTA;MXN;ETF;US;MEXI*;Desenvolvido;0
QLTI;GMO INTERNATIONAL QLTY ETF;QLTI;USD;ETF;US;AMEX;Desenvolvido;1
QLTY;GMO U.S. QUALITY ETF;QLTY;USD;ETF;US;IEX;Desenvolvido;1
QLV;FLEXSHARES US QUALITY LOW VO;QLV;USD;ETF;US;AMEX;Desenvolvido;1
QLVD;FLEXSHARES DEVELOPED MARKETS;QLVD;USD;ETF;US;AMEX;Desenvolvido;1
QLVE;FLEXSHARES EMERGING MARKETS;QLVE;USD;ETF;US;NYSENAT;Desenvolvido;1
QMAG;FT NDQ100 MOD BUFF ETF - AUG;QMAG;USD;ETF;US;ARCA;Desenvolvido;1
QMAR;FT VEST NASDAQ-100 BUFFER ET;QMAR;USD;ETF;US;IEX;Desenvolvido;1
QMID;WISDOMTREE U.S. MDCP QTY G F;QMID;USD;ETF;US;BEX;Desenvolvido;1
QMMY;FT NDQ100 MOD BUFF ETF - MAY;QMMY;USD;ETF;US;IEX;Desenvolvido;1
QMNV;FT NDQ100 MOD BUFF ETF - NOV;QMNV;USD;ETF;US;DRCTEDGE;Desenvolvido;1
QMOM;ALPHA US QUANT MOM ETF;QMOM;USD;ETF;US;LTSE;Desenvolvido;1
QNXT;ISHARES NSDQ 100 EX TOP 30;QNXT;USD;ETF;US;NYSENAT;Desenvolvido;1
QOWZ;INVESCO NAQ FREE CH FL A ETF;QOWZ;USD;ETF;US;NASDAQ*;Desenvolvido;1
QPFF;AMERICAN CENTURY QUAL PREF;QPFF;USD;ETF;US;LTSE;Desenvolvido;1
QPX;ADVISORSHARES Q DYN GROWTH;QPX;USD;ETF;US;ARCA*;Desenvolvido;1
QQA;INVESCO QQQ INCOME ADV ETF;QQA;USD;ETF;US;EDGEA;Desenvolvido;1
QQEW;FIRST TRUST NASDQ 100 EQ WEI;QQEW;USD;ETF;US;LTSE;Desenvolvido;1
QQH;HCM DEFENDER 100 INDEX ETF;QQH;USD;ETF;US;EDGEA;Desenvolvido;1
QQJG;INVESCO ESG NASDAQ NEXT GEN;QQJG;USD;ETF;US;DRCTEDGE;Desenvolvido;1
QQLV;INVESCO QQQ LOW VOLATIL ETF;QQLV;USD;ETF;US;CHX;Desenvolvido;1
QQMG;INVESCO ESG NASDAQ 100;QQMG;USD;ETF;US;AMEX;Desenvolvido;1
QQQ;INVESCO QQQ TRUST SERIES 1;QQQ;USD;ETF;US;AMEX;Desenvolvido;1
QQQ;INVESCO QQQ TRUST SERIES 1;QQQ;MXN;ETF;US;MEXI*;Desenvolvido;0
QQQA;PROSHARES NSDQ 100 D/W MOM;QQQA;USD;ETF;US;PHLX;Desenvolvido;1
QQQD;DIREXION DAILY MAGNIFICENT 7;QQQD;USD;ETF;US;AMEX;Desenvolvido;1
QQQE;DIREXION NASDAQ-100 EQ WEIGH;QQQE;USD;ETF;US;EDGEA;Desenvolvido;1
QQQG;PACER NDQ 100 TOP 50 CSH CW;QQQG;USD;ETF;US;NYSE;Desenvolvido;1
QQQI;NEOS NASDAQ-100 HIGH INC ETF;QQQI;USD;ETF;US;MEMX;Desenvolvido;1
QQQJ;INVESCO NASDAQ NEXT GEN 100;QQQJ;USD;ETF;US;OVERNIGHT;Desenvolvido;1
QQQM;INVESCO NASDAQ 100 ETF;QQQM;USD;ETF;US;EDGEA;Desenvolvido;1
QQQP;TRADR 2X LNG TRI Q QRTR ETF;QQQP;USD;ETF;US;IEX;Desenvolvido;1
QQQS;INVESCO NASDAQ FUT GEN 200;QQQS;USD;ETF;US;AMEX;Desenvolvido;1
QQQT;DEFIANCE NASDAQ 100 IN T ETF;QQQT;USD;ETF;US;BEX;Desenvolvido;1
QQQU;DIREXION DAILY MAGNIFICENT 7;QQQU;USD;ETF;US;BEX;Desenvolvido;1
QQQW;TRADR 2X LONG TRIQ WEEK ETF;QQQW;USD;ETF;US;BEX;Desenvolvido;1
QQQY;DFN NS 100 EN OP&0DTE IN ETF;QQQY;USD;ETF;US;AMEX;Desenvolvido;1
QQXT;FIRST TRUST NASDAQ-100 EX-TE;QQXT;USD;ETF;US;DRCTEDGE;Desenvolvido;1
QRFT;QRAFT AI-ENH US LRG CAP ETF;QRFT;USD;ETF;US;BATS;Desenvolvido;1
QRMI;GLOBAL X NASDAQ 100 RISK MAN;QRMI;USD;ETF;US;BYX;Desenvolvido;1
QSIG;WISDOMTREE US SHORT TERM COR;QSIG;USD;ETF;US;NYSE;Desenvolvido;1
QSIX;PACR META N100 DVD M 600 ETF;QSIX;USD;ETF;US;PHLX;Desenvolvido;1
QSML;WISDOMTREE U.S. SMALCP Q GF;QSML;USD;ETF;US;ARCA;Desenvolvido;1
QSPT;FT VEST NASDAQ-100 BUFFER ET;QSPT;USD;ETF;US;MEMX;Desenvolvido;1
QSWN;AMP BLACKSWAN TECH & TREASUR;QSWN;USD;ETF;US;LTSE;Desenvolvido;1
QTAP;INNOVATOR GRW 100 ACCL PLUS;QTAP;USD;ETF;US;LTSE;Desenvolvido;1
QTEC;FIRST TRUST NASDQ 100 TECH I;QTEC;USD;ETF;US;AMEX;Desenvolvido;1
QTEC;FIRST TRUST NASDQ 100 TECH I;QTEC;MXN;ETF;US;MEXI*;Desenvolvido;0
QTJA;INNOVATOR GROWTH ACC PLUS-J;QTJA;USD;ETF;US;EDGEA;Desenvolvido;1
QTJL;INN GROWTH ACCEL PLUS JULY;QTJL;USD;ETF;US;MEMX;Desenvolvido;1
QTOC;INNOVATOR GROWTH ACCEL PL-OC;QTOC;USD;ETF;US;DRCTEDGE;Desenvolvido;1
QTOP;ISHARES NSDQ TOP 30 STOCKS;QTOP;USD;ETF;US;DRCTEDGE;Desenvolvido;1
QTPI;NRTH SQUR RCIM TAX-AD IS ETF;QTPI;USD;ETF;US;BATS;Desenvolvido;1
QTR;GLOBAL X NASDAQ 100 TAIL RIS;QTR;USD;ETF;US;NYSENAT;Desenvolvido;1
QTUM;DEFIANCE QUANTUM ETF;QTUM;USD;ETF;US;AMEX;Desenvolvido;1
QTUM;DEFIANCE QUANTUM ETF;QTUM;MXN;ETF;US;MEXI*;Desenvolvido;0
QUAL;ISHARES MSCI USA QUALITY FAC;QUAL;USD;ETF;US;LTSE;Desenvolvido;1
QUAL;ISHARES MSCI USA QUALITY FAC;QUAL;MXN;ETF;US;MEXI*;Desenvolvido;0
QULL;ETRACS 2X QUALITY FACTR TR;QULL;USD;ETF;US;MEMX;Desenvolvido;1
QUS;SPDR MSCI USA STRATEGICFACTO;QUS;USD;ETF;US;BEX;Desenvolvido;1
QUS;SPDR MSCI USA STRATEGICFACTO;QUS;MXN;ETF;US;MEXI*;Desenvolvido;0
QUVU;HARTFORD QUALITY VALUE ETF;QUVU;USD;ETF;US;BATS*;Desenvolvido;1
QVAL;ALPHA ARCH US QNT VALUE ETF;QVAL;USD;ETF;US;PHLX;Desenvolvido;1
QVML;INVESCO S&P 500 QVM MULTI-FA;QVML;USD;ETF;US;EDGEA;Desenvolvido;1
QVMM;INVESCO S&P MIDCAP 400 QVM M;QVMM;USD;ETF;US;OVERNIGHT;Desenvolvido;1
QVMS;INVESCO S&P SMALLCAP 600 QVM;QVMS;USD;ETF;US;AMEX;Desenvolvido;1
QVOY;Q3 ALL-SEASON ACTIVE ROT ETF;QVOY;USD;ETF;US;IEX;Desenvolvido;1
QWLD;SPDR MSCI WORLD STRATEGICFAC;QWLD;USD;ETF;US;DRCTEDGE;Desenvolvido;1
QXQ;SGI ENHANCED NASDAQ-100 ETF;QXQ;USD;ETF;US;NYSE;Desenvolvido;1
QYLD;GLOBAL X NASD 100 COV CALL;QYLD;USD;ETF;US;MEMX;Desenvolvido;1
QYLD;GLOBAL X NASD 100 COV CALL;QYLD;MXN;ETF;US;MEXI*;Desenvolvido;0
QYLE;GLOBAL X NASDAQ 100 ESG CV C;QYLE;USD;ETF;US;ARCA;Desenvolvido;1
QYLE;GLOBAL X NASDAQ 100 ESG CV C;QYLE;MXN;ETF;US;MEXI*;Desenvolvido;0
QYLG;GLOBAL X NASDAQ 100 COVC GRW;QYLG;USD;ETF;US;NYSE;Desenvolvido;1
R321;RENAISSANCE IPO ETF;R321;EUR;ETF;US;GETTEX*;Desenvolvido;0
RAAX;VANECK REAL ASSETS ETF;RAAX;USD;ETF;US;DRCTEDGE;Desenvolvido;1
RAFE;PIMCO RAFI ESG US ETF;RAFE;USD;ETF;US;IEX;Desenvolvido;1
RATE;GLOBAL X INTEREST RATE HEDGE;RATE;USD;ETF;US;BATS;Desenvolvido;1
RAVI;FLEXSHARES ULTRA-SHORT INCOM;RAVI;USD;ETF;US;DRCTEDGE;Desenvolvido;1
RAYC;RAYLIANT QUANTAMENTAL CHINA;RAYC;USD;ETF;US;NYSENAT;Desenvolvido;1
RAYD;RAYLIANT QUANT DEV MKT EQTY;RAYD;USD;ETF;US;CHX;Desenvolvido;1
RAYE;RAYLIANT QUANTAMENTAL EMERGI;RAYE;USD;ETF;US;DRCTEDGE;Desenvolvido;1
RAYJ;RAYLIANT SMDAM JAPAN EQT ETF;RAYJ;USD;ETF;US;IEX;Desenvolvido;1
RAYS;GLOBAL X SOLAR ETF;RAYS;USD;ETF;US;MEMX;Desenvolvido;1
RAYS;GLOBAL X SOLAR ETF;RAYS;MXN;ETF;US;MEXI*;Desenvolvido;0
RBLD;FIRST TRUST ALERIAN US NEXTG;RBLD;USD;ETF;US;NYSENAT;Desenvolvido;1
RBUF;INVV US SML C 10 B ETF-QRT;RBUF;USD;ETF;US;NYSENAT;Desenvolvido;1
RDFI;RAREVIEW DYNAMIC FIXED INCOM;RDFI;USD;ETF;US;PSX;Desenvolvido;1
RDIV;INVESCO S&P ULTRA DIVIDEND;RDIV;USD;ETF;US;EDGEA;Desenvolvido;1
RDOG;ALPS REIT DIVIDEND DOGS ETF;RDOG;USD;ETF;US;AMEX;Desenvolvido;1
RDTE;RONDHIL SMA CAP 0DTE C S ETF;RDTE;USD;ETF;US;DRCTEDGE;Desenvolvido;1
RDVI;FT VEST RISING DIVIDEND ACHI;RDVI;USD;ETF;US;ARCA;Desenvolvido;1
RDVY;FIRST TRUST RISING DIVIDEND;RDVY;USD;ETF;US;MEMX;Desenvolvido;1
RDVY;FIRST TRUST RISING DIVIDEND;RDVY;MXN;ETF;US;MEXI*;Desenvolvido;0
REAI;TIDAL ETF TRUST INTELLIGENT;REAI;USD;ETF;US;BEX;Desenvolvido;1
RECS;COLUMBIA RESRH ENHANCED CORE;RECS;USD;ETF;US;NYSE;Desenvolvido;1
REET;ISHARES GLOBAL REIT ETF;REET;USD;ETF;US;IEX;Desenvolvido;1
REGL;PRSHRS S&P MID 400 DVD ARIST;REGL;USD;ETF;US;BYX;Desenvolvido;1
REIT;ALPS ACTIVE REIT ETF;REIT;USD;ETF;US;CHX;Desenvolvido;1
REK;PROSHARES SHORT REAL ESTATE;REK;USD;ETF;US;MEMX;Desenvolvido;1
REKT;DX DLY CRYPT INDUS BEAR 1X;REKT;USD;ETF;US;DRCTEDGE;Desenvolvido;1
REM;ISHARES MORTGAGE REAL ESTATE;REM;USD;ETF;US;BEX;Desenvolvido;1
REM;ISHARES MORTGAGE REAL ESTATE;REM;MXN;ETF;US;MEXI*;Desenvolvido;0
REMX;VANECK RAR EARTH ND STG-USDI;REMX;USD;ETF;US;ARCA*;Desenvolvido;1
RETL;DIREXION DLY RETAIL BULL 3X;RETL;USD;ETF;US;BEX;Desenvolvido;1
REVS;COLUMBIA RESEARCH ENHANCED V;REVS;USD;ETF;US;PSX;Desenvolvido;1
REW;PROSHARES ULTRASHORT TECH;REW;USD;ETF;US;DRCTEDGE;Desenvolvido;1
REZ;ISHARS RES AND MULTI REALES;REZ;USD;ETF;US;IEX;Desenvolvido;1
REZ;ISHARS RES AND MULTI REALES;REZ;MXN;ETF;US;MEXI*;Desenvolvido;0
RFCI;RIVERFRONT DYNAMIC CORE INC;RFCI;USD;ETF;US;AMEX;Desenvolvido;1
RFDA;RIVERFRONT DYNAMIC US DV ETF;RFDA;USD;ETF;US;CHX;Desenvolvido;1
RFDI;FIRST TRST DYN DEVEL INT ETF;RFDI;USD;ETF;US;BEX;Desenvolvido;1
RFEM;FIRST TRUST RIVERFRONT DYNAM;RFEM;USD;ETF;US;MEMX;Desenvolvido;1
RFEU;FIRST TR DYNAMIC EUROPE ETF;RFEU;USD;ETF;US;NASDAQ*;Desenvolvido;1
RFFC;ALPS ACTIVE EQUITY OPPORTUNI;RFFC;USD;ETF;US;AMEX;Desenvolvido;1
RFG;INVESCO S&P MIDCAP 400 PURE;RFG;USD;ETF;US;NYSEFLOOR;Desenvolvido;1
RFIX;SIMPLIFY DWN INT HDG STR ETF;RFIX;USD;ETF;US;AMEX;Desenvolvido;1
RFLR;INNOVATOR US S CAP MNG F ETF;RFLR;USD;ETF;US;ARCA*;Desenvolvido;1
RFV;INVESCO S&P MIDCAP 400 PURE;RFV;USD;ETF;US;MEMX;Desenvolvido;1
RGEF;RCKEFLLR GBL EQT ETF;RGEF;USD;ETF;US;ISLAND;Desenvolvido;1
RHRX;RH TACTICAL ROTATION ETF;RHRX;USD;ETF;US;MEMX;Desenvolvido;1
RHTX;RH TACTICAL OUTLOOK;RHTX;USD;ETF;US;BEX;Desenvolvido;1
RIET;HOYA CAPITAL HI DVD YLD ETF;RIET;USD;ETF;US;AMEX;Desenvolvido;1
RIGS;RIVERFRONT STRATEGIC INCOME;RIGS;USD;ETF;US;AMEX;Desenvolvido;1
RILA;INDEXPERTS GORILLA AGR G ETF;RILA;USD;ETF;US;DRCTEDGE;Desenvolvido;1
RINC;AXS REAL ESTATE INCOME ETF;RINC;USD;ETF;US;BYX;Desenvolvido;1
RINF;PROSHARES INFLATION EXPECTAT;RINF;USD;ETF;US;CHX;Desenvolvido;1
RING;ISHARES MSCI GLOBAL GOLD MIN;RING;USD;ETF;US;DRCTEDGE;Desenvolvido;1
RING;ISHARES MSCI GLOBAL GOLD MIN;RING;MXN;ETF;US;MEXI*;Desenvolvido;0
RIOX;DEFIANCE DLY TRG 2X LNG RIOT;RIOX;USD;ETF;US;ISLAND;Desenvolvido;1
RISN;INSPIRE TACTICAL BALANCED ET;RISN;USD;ETF;US;BEX;Desenvolvido;1
RISR;FOLIOBE ALTR IN&IN H ETF-USD;RISR;USD;ETF;US;EDGEA;Desenvolvido;1
RITA;ETFB GREEN SRI REITS ETF;RITA;USD;ETF;US;CHX;Desenvolvido;1
RJMG;FT RAYJA MULTICAP GROWTH ETF;RJMG;USD;ETF;US;IEX;Desenvolvido;1
RLY;SPDR SSGA MULTI-ASSET REAL R;RLY;USD;ETF;US;AMEX;Desenvolvido;1
RMCA;RCKFLR CAL MUNI BOND ETF;RMCA;USD;ETF;US;NYSE;Desenvolvido;1
RMIF;LHA RISK MANAGED INCOME ETF;RMIF;USD;ETF;US;AMEX;Desenvolvido;1
RMNY;RCKFLR NY MUNI BOND ETF;RMNY;USD;ETF;US;EDGEA;Desenvolvido;1
RMOP;RCKFLR OPP MUNI BD ETF;RMOP;USD;ETF;US;ISLAND;Desenvolvido;1
RND;FT BBG R&D LEADERS ETF;RND;USD;ETF;US;AMEX;Desenvolvido;1
RNEM;EMERGING MARKETS EQTY SELECT;RNEM;USD;ETF;US;AMEX;Desenvolvido;1
RNEW;VANECK GREEN INFRASTRUCTURE;RNEW;USD;ETF;US;LTSE;Desenvolvido;1
RNRG;GLOBAL X RENEWABLE ENER PROD;RNRG;USD;ETF;US;IEX;Desenvolvido;1
RNRG;GLOBAL X RENEWABLE ENER PROD;RNRG;MXN;ETF;US;MEXI*;Desenvolvido;0
RNWZ;TRUESH EAGLE GL RENEW EN INC;RNWZ;USD;ETF;US;EDGEA;Desenvolvido;1
ROAM;HARTFORD MULTIFACT EMRG MRKT;ROAM;USD;ETF;US;NYSENAT;Desenvolvido;1
ROBO;ROBO GLOBAL ROBOTICS AND AUT;ROBO;USD;ETF;US;ARCA*;Desenvolvido;1
ROBO;ROBO GLOBAL ROBOTICS AND AUT;ROBO;MXN;ETF;US;MEXI*;Desenvolvido;0
ROBT;FIRST TRUST NASDAQ ARTIFICIA;ROBT;USD;ETF;US;AMEX;Desenvolvido;1
ROBT;FIRST TRUST NASDAQ ARTIFICIA;ROBT;MXN;ETF;US;MEXI*;Desenvolvido;0
RODE;HARTFORD MULTIFACT DIV INTL;RODE;USD;ETF;US;MEMX;Desenvolvido;1
RODM;HARTFORD MULTIFACT DEV MRKT;RODM;USD;ETF;US;EDGX;Desenvolvido;1
ROE;AST US EQ WGT QLTY KINGS ETF;ROE;USD;ETF;US;NASDAQ*;Desenvolvido;1
ROIS;HARTFORD MULTI INT SM CO ETF;ROIS;USD;ETF;US;BEX;Desenvolvido;1
ROKT;SPDR S&P KENSHO FINAL FRONTI;ROKT;USD;ETF;US;NYSE;Desenvolvido;1
ROM;PROSHARES ULTRA TECHNOLOGY;ROM;USD;ETF;US;DRCTEDGE;Desenvolvido;1
ROMO;STRATEGY SHARES NEWFOUND/RES;ROMO;USD;ETF;US;AMEX;Desenvolvido;1
